Name	Emittent	ISIN
ISHARES STOXX EUROPE 600 HEALTHCARE (DE) 	iShares [DE] I Investmentaktiengesellschaft mit … 	DE000A0Q4R36 
ISHARES STOXX EUROPE 600 IG & SER (DE) 	iShares [DE] I Investmentaktiengesellschaft mit … 	DE000A0H08J9 
ISHARES STOXX EUROPE 600 INSURANCE (DE) 	iShares [DE] I Investmentaktiengesellschaft mit … 	DE000A0H08K7 
ISHARES STOXX EUROPE 600 MEDIA (DE) 	iShares [DE] I Investmentaktiengesellschaft mit … 	DE000A0H08L5 
ISHARES STOXX EUROPE 600 OIL & GAS (DE) 	iShares [DE] I Investmentaktiengesellschaft mit … 	DE000A0H08M3 
ISHARES STOXX EUROPE 600 REAL EST (DE) 	iShares [DE] I Investmentaktiengesellschaft mit … 	DE000A0Q4R44 
ISHARES STOXX EUROPE 600 RETAIL (DE) 	iShares [DE] I Investmentaktiengesellschaft mit … 	DE000A0H08P6 
ISHARES STOXX EUROPE 600 TECHNOLOGY (DE) 	iShares [DE] I Investmentaktiengesellschaft mit … 	DE000A0H08Q4 
ISHARES STOXX EUROPE 600 TELECOM (DE) 	iShares [DE] I Investmentaktiengesellschaft mit … 	DE000A0H08R2 
ISHARES STOXX EUROPE 600 TRAV & LEIS(DE) 	iShares [DE] I Investmentaktiengesellschaft mit … 	DE000A0H08S0 
ISHARES STOXX EUROPE 600 UTILITIES (DE) 	iShares [DE] I Investmentaktiengesellschaft mit … 	DE000A0Q4R02 
ISHARES STOXX EUROPE LARGE 200 (DE) 	BlackRock Asset Management Deutschland AG (KVG) 	DE0005933980 
ISHARES STOXX EUROPE MID 200 (DE) 	BlackRock Asset Management Deutschland AG (KVG) 	DE0005933998 
ISHARES STOXX EUROPE SEL DIV 30 (DE) 	BlackRock Asset Management Deutschland AG (KVG) 	DE0002635299 
ISHARES STOXX EUROPE SMALL 200 (DE) 	BlackRock Asset Management Deutschland AG (KVG) 	DE000A0D8QZ7 
ISHARES STOXX EURP 600 P & H GOODS (DE) 	iShares [DE] I Investmentaktiengesellschaft mit … 	DE000A0H08N1 
ISHARES STOXX GLOBAL SEL DIV 100 (DE) 	iShares [DE] I Investmentaktiengesellschaft mit … 	DE000A0F5UH1 
ISHARES TECDAX ETF (DE) 	BlackRock Asset Management Deutschland AG (KVG) 	DE000A2QP323 
ISHARES TECDAX ETF (DE) 	BlackRock Asset Management Deutschland AG (KVG) 	DE0005933972 
ISHARES THOMSON REUTERS INCL & DIVST ETF 	BlackRock Asset Management Ireland Ltd. 	IE00BD0B9B76 
ISHARES ú INDEX-LNKD GILTS ETF 	BlackRock Asset Management Ireland Ltd. 	IE00B1FZSD53 
ISHARES UK DIVIDEND ETF 	BlackRock Asset Management Ireland Ltd. 	IE00B0M63060 
ISHARES US AGGREGATE BOND ETF 	BlackRock Asset Management Ireland Ltd. 	IE00B44CGS96 
ISHARES US MORTG BACKED SECS ETF 	BlackRock Asset Management Ireland Ltd. 	IE00BZ6V7883 
ISHARES US PROPERTY YIELD ETF 	BlackRock Asset Management Ireland Ltd. 	IE00B1FZSF77 
ISHS3 M PXJ ELE DLA 	BlackRock Asset Management Ireland Ltd. 	IE00BMDBMK72 
JPM BETABUILDERS EUR GOVT BD 1-3 YR ETF 	JPMorgan Asset Management [Europe] S.à r.l. 	IE00BYVZV757 
JPM BETABUILDERS EUR GOVT BOND ETF 	JPMorgan Asset Management [Europe] S.à r.l. 	IE00BJK9HD13 
JPM BETABUILDERS US EQUITY ETF 	JPMorgan Asset Management [Europe] S.à r.l. 	IE00BJK9H860 
JPM BETABUILDERS US EQUITY ETF 	JPMorgan Asset Management [Europe] S.à r.l. 	IE00BJK9H753 
JPM BETABUILDERS US TREASURY BOND ETF 	JPMorgan Asset Management [Europe] S.à r.l. 	IE00BJK9HH50 
JPM BETABUILDERS US TRS BD 0-1 YR ETF 	JPMorgan Asset Management [Europe] S.à r.l. 	IE00BJK3WF00 
JPM BETABUILDERS US TRS BD 1-3 YR ETF 	JPMorgan Asset Management [Europe] S.à r.l. 	IE00BD9MMD49 
JPM CARBON TRANSITION GLOBAL EQUITY ETF 	JPMorgan Asset Management [Europe] S.à r.l. 	IE000W95TAE6 
JPM EUR CORP BD 1-5YR RSRCH ENH ESG ETF 	JPMorgan Asset Management [Europe] S.à r.l. 	IE00BF59RW70 
JPM EUR CORP BD RSRCH ENH ESG ETF 	JPMorgan Asset Management [Europe] S.à r.l. 	IE00BF59RX87 
JPM EUR ULTRA-SHORT INCOME ETF 	JPMorgan Asset Management [Europe] S.à r.l. 	IE00BD9MMF62 
JPM EUROPE RESEARCH ENHANCED EQ ESG ETF 	JPMorgan Asset Management [Europe] S.à r.l. 	IE00BF4G7183 
JPM GLOBAL EM MKTS RSH ENH EQ ESG ETF 	JPMorgan Asset Management [Europe] S.à r.l. 	IE00BF4G6Z54 
JPM GLOBAL EQUITY MULTI-FACTOR ETF 	JPMorgan Asset Management [Europe] S.à r.l. 	IE00BJRCLL96 
JPM GLOBAL RESEARCH ENHANCED EQ ESG ETF 	JPMorgan Asset Management [Europe] S.à r.l. 	IE00BF4G6Y48 
JPM US RESEARCH ENHANCED EQ ESG ETF 	JPMorgan Asset Management [Europe] S.à r.l. 	IE00BF4G7076 
JPM USD CORP BD RSRCH ENH ESG ETF 	JPMorgan Asset Management [Europe] S.à r.l. 	IE00BF59RV63 
JPM USD EMERGING MARKETS SOV BD ETF 	JPMorgan Asset Management [Europe] S.à r.l. 	IE00BDFC6G93 
JPM USD EMERGING MARKETS SOV BD ETF 	JPMorgan Asset Management [Europe] S.à r.l. 	IE00BDDRDY39 
JPM USD ULTRA-SHORT INCOME ETF 	JPMorgan Asset Management [Europe] S.à r.l. 	IE00BG8BCY43 
JPM USD ULTRA-SHORT INCOME ETF 	JPMorgan Asset Management [Europe] S.à r.l. 	IE00BDFC6Q91 
L&G ARTIFICIAL INTELLIGENCE ETF 	LGIM Managers (Europe) Limited 	IE00BK5BCD43 
L&G ASIA PACIFIC EX JAPAN EQUITY ETF 	LGIM Managers (Europe) Limited 	IE00BFXR5W90 
L&G BATTERY VALUE-CHAIN ETF 	LGIM Managers (Europe) Limited 	IE00BF0M2Z96 
L&G CLEAN ENERGY ETF 	LGIM Managers (Europe) Limited 	IE00BK5BCH80 
L&G CLEAN WATER ETF 	LGIM Managers (Europe) Limited 	IE00BK5BC891 
L&G CYBER SECURITY ETF 	LGIM Managers (Europe) Limited 	IE00BYPLS672 
L&G DIGITAL PAYMENTS ETF 	LGIM Managers (Europe) Limited 	IE00BF92J153 
L&G ECOMMERCE LOGISTICS ETF 	LGIM Managers (Europe) Limited 	IE00BF0M6N54 
L&G GLOBAL EQUITY ETF 	LGIM Managers (Europe) Limited 	IE00BFXR5S54 
L&G GOLD MINING ETF 	LGIM Managers (Europe) Limited 	IE00B3CNHG25 
L&G HEALTHCARE BREAKTHROUGH ETF 	LGIM Managers (Europe) Limited 	IE00BK5BC677 
L&G HYDROGEN ECONOMY ETF 	LGIM Managers (Europe) Limited 	IE00BMYDM794 
L&G JAPAN EQUITY ETF 	LGIM Managers (Europe) Limited 	IE00BFXR5T61 
L&G PHARMA BREAKTHROUGH ETF 	LGIM Managers (Europe) Limited 	IE00BF0H7608 
L&G QUAL EQ DIV ESG EXCLS AP EX-JPN ETF 	LGIM Managers (Europe) Limited 	IE00BMYDMB35 
L&G ROBO GLOBAL ROBOTICS AND ATMTN ETF 	LGIM Managers (Europe) Limited 	IE00BMW3QX54 
L&G RUSSELL 2000 US SMALL CAP ETF 	LGIM Managers (Europe) Limited 	IE00B3CNHJ55 
L&G US ENERGY INFRASTRUCTURE MLP ETF 	LGIM Managers (Europe) Limited 	IE00BHZKHS06 
L&G US EQUITY (RESPONSIBLE EXCLSNS) ETF 	LGIM Managers (Europe) Limited 	IE00BKLWY790 
L&GE FUND MSCI CHINA A ETF 	LGIM Managers (Europe) Limited 	IE00BHBFDF83 
LG-EMCYSEESGEX ETFDLA 	LGIM Managers (Europe) Limited 	IE000ST40PX8 
LG-ME.ESG EXC. ETFDLA 	LGIM Managers (Europe) Limited 	IE0004U3TX15 
LG.G.E.L.G.T.E. DLA 	Legal & General Investment Management Ltd. 	IE000VTOHNZ0 
LG.GN E.L.O.T.P DLA 	Legal & General Investment Management Ltd. 	IE000QNJAOX1 
LYXOR 1 DAX 50 ESG (DR) ETF 	Amundi Luxembourg S.A. 	DE000ETF9090 
LYXOR 1 DIVDAX (DR) ETF 	Amundi Luxembourg S.A. 	DE000ETF9033 
LYXOR 1 MDAX (DR) ETF 	Amundi Luxembourg S.A. 	DE000ETF9074 
LYXOR 1 STOXX EUROPE 600 ESG (DR) ETF 	Amundi Luxembourg S.A. 	DE000ETF9603 
LYXOR 1 TECDAX (DR) ETF 	Amundi Luxembourg S.A. 	DE000ETF9082 
LYXOR 10Y US TRSRY DLY -2X INVERSE ETF 	Amundi Asset Management 	FR0011607084 
LYXOR BUND DAILY (-2X) INVERSE ETF 	Amundi Asset Management 	FR0010869578 
LYXOR BUND-FUTURE SHORT ETF 	Amundi Luxembourg S.A. 	LU0530119774 
LYXOR CAC 40 (DR) ETF 	Amundi Asset Management 	FR0007052782 
LYXOR CMDTS RFNTV/CRCMD CRB TR ETF 	Amundi Asset Management 	LU1829218749 
LYXOR CORE MSCI EMU DR ETF 	Amundi Asset Management 	LU1646360971 
LYXOR CORE MSCI JAPAN (DR) ETF 	Amundi Asset Management 	LU2133056387 
LYXOR CORE MSCI JAPAN (DR) ETF 	Amundi Asset Management 	LU2090063673 
LYXOR CORE MSCI JAPAN (DR) ETF 	Amundi Asset Management 	LU1781541252 
LYXOR CORE MSCI WORLD (DR) ETF 	Amundi Asset Management 	LU1781541179 
LYXOR CORE STOXX EUROPE 600 (DR) 	Amundi Asset Management 	LU0908500753 
LYXOR CORE UK EQUITY ALL CAP (DR) ETF 	Amundi Asset Management 	LU1781541096 
LYXOR CORE US EQUITY (DR) ETF - DIST 	Amundi Asset Management 	LU1781540957 
LYXOR CORE US TIPS (DR) ETF 	Amundi Asset Management 	LU1452600270 
LYXOR CORE US TREASURY 7-10Y (DR) ETF 	Amundi Asset Management 	LU1407888053 
LYXOR CR EURO GOVT INFL-LNKD BD (DR) ETF 	Amundi Asset Management 	LU1650491795 
LYXOR CR EURO GOVT INFL-LNKD BD (DR) ETF 	Amundi Asset Management 	LU1650491282 
LYXOR DAILY LEVDAX ETF 	Amundi Asset Management 	LU2090062600 
LYXOR DAILY LEVDAX ETF 	Amundi Asset Management 	LU0252634307 
LYXOR DAILY SHORTDAX X2 ETF 	Amundi Asset Management 	FR0010869495 
LYXOR DAX (DR) ETF 	Amundi Asset Management 	LU2090062436 
LYXOR DAX (DR) ETF 	Amundi Asset Management 	LU0252633754 
LYXOR DAX ETF 	Amundi Luxembourg S.A. 	LU0378438732 
LYXOR DIVDAX ETF 	Amundi Luxembourg S.A. 	LU0603933895 
LYXOR DOW JONES INDUSTRIAL AVERAGE ETF 	Amundi Asset Management 	FR0007056841 
LYXOR DOW JONES INDUSTRIAL AVG ETF 	Amundi Luxembourg S.A. 	LU0378437502 
LYXOR ERHGRTDMACRWTGTBD1-3YDRETF 	Amundi Asset Management 	LU1829219556 
LYXOR ERHGRTDMACRWTGTBD3-5YDRETF 	Amundi Asset Management 	LU1829219713 
LYXOR ESG EURO CORP BD EX FCL DR ETF 	Amundi Asset Management 	LU1829218822 
LYXOR ESG EURO HIGH YIELD (DR) ETF 	Amundi Asset Management 	LU1812090543 
LYXOR ESG USD CORP BD (DR) ETF 	Amundi Asset Management 	LU1285960032 
LYXOR ESG USD HIGH YIELD (DR) ETF 	Amundi Asset Management 	LU1435356149 
LYXOR EUR 2-10Y INFLATION EXPCT ETF 	Amundi Asset Management 	LU1390062245 
LYXOR EURO ESG CORPORATE BOND ETF 	Amundi Asset Management 	LU1829219127 
LYXOR EURO GOVERNMENT BOND 25+Y (DR) ETF 	Amundi Asset Management 	LU1686832277 
LYXOR EURO GOVERNMENT GREEN BOND DR ETF 	Amundi Asset Management 	LU2356220926 
LYXOR EURO GOVT BD (DR) ETF 	Amundi Asset Management 	LU1650490474 
LYXOR EURO GOVT BD 1-3Y (DR) ETF 	Amundi Asset Management 	LU1650487926 
LYXOR EURO GOVT BD 1-3Y (DR) ETF 	Amundi Asset Management 	LU1650487413 
LYXOR EURO GOVT BD 10-15Y (DR) ETF 	Amundi Asset Management 	LU1650489898 
LYXOR EURO GOVT BD 10-15Y (DR) ETF 	Amundi Asset Management 	LU1650489385 
LYXOR EURO GOVT BD 15+Y (DR) ETF 	Amundi Asset Management 	LU2090062782 
LYXOR EURO GOVT BD 15+Y (DR) ETF 	Amundi Asset Management 	LU1287023268 
LYXOR EURO GOVT BD 3-5Y (DR) ETF 	Amundi Asset Management 	LU1650488817 
LYXOR EURO GOVT BD 3-5Y (DR) ETF 	Amundi Asset Management 	LU1650488494 
LYXOR EURO GOVT BD 5-7Y (DR) ETF 	Amundi Asset Management 	LU2090062865 
LYXOR EURO GOVT BD 5-7Y (DR) ETF 	Amundi Asset Management 	LU1287023003 
LYXOR EURO GOVT BD 7-10Y (DR) ETF 	Amundi Asset Management 	LU2090062949 
LYXOR EURO GOVT BD 7-10Y (DR) ETF 	Amundi Asset Management 	LU1287023185 
LYXOR EURO OVERNIGHT RETURN ETF 	Amundi Asset Management 	FR0010510800 
LYXOR EURO STOXX 50 (DR) ETF 	Amundi Asset Management 	FR0007054358 
LYXOR EURO STOXX 50 DLY -1X INVERSE ETF 	Amundi Asset Management 	FR0010424135 
LYXOR EURO STOXX 50 DLY -2X INVERSE ETF 	Amundi Asset Management 	FR0010424143 
LYXOR EURO STOXX BANKS (DR) ETF 	Amundi Asset Management 	LU1829219390 
LYXOR EURO STOXX SELECT DIV 30 ETF 	Amundi Luxembourg S.A. 	LU0378434236 
LYXOR EUROMTS HR MCWTD GB (DR)ETF 	Amundi Asset Management 	LU1287023342 
LYXOR F.A.Z. 100 INDEX ETF 	Amundi Luxembourg S.A. 	LU0650624025 
LYXOR FED FUNDS US DOLLAR CASH ETF 	Amundi Asset Management 	LU2090062352 
LYXOR FTSE 100 ETF 	Amundi Asset Management 	LU1650492330 
LYXOR FTSE 100 ETF 	Amundi Asset Management 	LU1650492256 
LYXOR FTSE 100 ETF 	Amundi Asset Management 	LU1650492173 
LYXOR FTSE CHINA A50 ETF 	Amundi Luxembourg S.A. 	LU0947415054 
LYXOR FTSE EPR/NRT GLBL DEV ETF 	Amundi Asset Management 	LU1832418773 
LYXOR FTSE MIB (DR) ETF 	Amundi Asset Management 	FR0010010827 
LYXOR GERMAN MID-CAP MDAX ETF 	Amundi Asset Management 	FR0011857234 
LYXOR GLOBAL GENDER EQUALITY (DR) ETF 	Amundi Asset Management 	LU1691909508 
LYXOR GREEN BOND (DR) ETF 	Amundi Asset Management 	LU1563454823 
LYXOR GREEN BOND (DR) ETF 	Amundi Asset Management 	LU1563454310 
LYXOR GREEN BOND ESG SCREENED (DR) ETF 	Amundi Asset Management 	LU1981859819 
LYXOR HONG KONG HSI ETF 	Amundi Asset Management 	LU1900067940 
LYXOR HWABAO WP MSCI CHINA A (DR) ETF 	Amundi Asset Management 	FR0011720911 
LYXOR IBOXX $ LIQUID EMERG MKTS SOV ETF 	Amundi Asset Management 	LU1686830909 
LYXOR IBOXX EUR LIQUID HIGH YIELD BB ETF 	Amundi Asset Management 	LU1215415214 
LYXOR INDEX FUND EURO STOXX 50 (DR) 	Amundi Asset Management 	LU0908501488 
LYXOR INDEX FUND EURO STOXX 50 (DR) 	Amundi Asset Management 	LU0908501215 
LYXOR JAPAN (TOPIX) DR ETF 	Amundi Asset Management 	FR0011475078 
LYXOR JAPAN (TOPIX) DR ETF 	Amundi Asset Management 	FR0010245514 
LYXOR MDAX ETF 	Amundi Luxembourg S.A. 	LU1033693638 
LYXOR MSCI AC ASIA PACIFIC EX JAPAN ETF 	Amundi Asset Management 	LU1900068328 
LYXOR MSCI ALL COUNTRY WORLD ETF 	Amundi Asset Management 	LU1829220216 
LYXOR MSCI CHINA ESG LEADERS EXTR DR ETF 	Amundi Asset Management 	LU1900068914 
LYXOR MSCI CHINA ETF 	Amundi Asset Management 	LU1841731745 
LYXOR MSCI DIGITAL ECO ESG FTD (DR) ETF 	Amundi Asset Management 	LU2023678878 
LYXOR MSCI DSRP TECH ESG FTD (DR) ETF 	Amundi Asset Management 	LU2023678282 
LYXOR MSCI EASTERN EUROPE EX RUSSIA ETF 	Amundi Asset Management 	LU2090063160 
LYXOR MSCI EASTERN EUROPE EX RUSSIA ETF 	Amundi Asset Management 	LU1900066462 
LYXOR MSCI EM ASIA ETF 	Amundi Asset Management 	LU1781541849 
LYXOR MSCI EM ESG LEADERS EXTRA ETF 	Amundi Asset Management 	LU1769088581 
LYXOR MSCI EMERGING MARKETS ETF 	Amundi Asset Management 	FR0010429068 
LYXOR MSCI EMERGING MARKETS EX CHINA ETF 	Amundi Asset Management 	LU2009202107 
LYXOR MSCI EMERGING MARKETS TRN ETF 	Amundi Luxembourg S.A. 	LU0635178014 
LYXOR MSCI EMU ESG (DR) - UCITS ETF 	Amundi Asset Management 	LU0908501058 
LYXOR MSCI EMU GROWTH (DR) ETF 	Amundi Asset Management 	LU1598688189 
LYXOR MSCI EMU SMALL CAP ETF 	Amundi Asset Management 	LU1598689153 
LYXOR MSCI EMU VALUE (DR) ETF 	Amundi Asset Management 	LU1598690169 
LYXOR MSCI EUROPE (DR) ETF 	Amundi Asset Management 	FR0010261198 
LYXOR MSCI EUROPE ESG LEADERS (DR) ETF 	Amundi Asset Management 	LU1940199711 
LYXOR MSCI EUROPE MID CAP TRN ETF 	Amundi Luxembourg S.A. 	LU0392496260 
LYXOR MSCI EUROPE SMALL CAP TRN ETF 	Amundi Luxembourg S.A. 	LU0392496344 
LYXOR MSCI FUTURE MBY ESG FTD (DR) ETF 	Amundi Asset Management 	LU2023679090 
LYXOR MSCI INDIA ETF 	Amundi Asset Management 	FR0010361683 
LYXOR MSCI INDONESIA ETF 	Amundi Asset Management 	LU1900065811 
LYXOR MSCI KOREA ETF 	Amundi Asset Management 	LU1900066975 
LYXOR MSCI MILLENNIALS ESG FTD (DR) ETF 	Amundi Asset Management 	LU2023678449 
LYXOR MSCI NEW ENERGY ESG FILTRD DR ETF 	Amundi Asset Management 	FR0010524777 
LYXOR MSCI NORTH AMERICA TRN ETF 	Amundi Luxembourg S.A. 	LU0392494992 
LYXOR MSCI PACIFIC EX JAPAN ETF 	Amundi Asset Management 	LU1220245556 
LYXOR MSCI PACIFIC TRN ETF 	Amundi Luxembourg S.A. 	LU0392495023 
LYXOR MSCI ROBOTICS &AI ESG FILTERED ETF 	Amundi Asset Management 	LU1838002480 
LYXOR MSCI SEMICONDUCTORS ESG ETF 	Amundi Asset Management 	LU2090063327 
LYXOR MSCI SMART CITIES ESG FTD (DR) ETF 	Amundi Asset Management 	LU2023679256 
LYXOR MSCI TURKEY ETF 	Amundi Asset Management 	LU1900067601 
LYXOR MSCI USA ESG (DR) ETF 	Amundi Asset Management 	FR0010296061 
LYXOR MSCI USA ESG LDRS EXTR (DR)ETF 	Amundi Asset Management 	LU1792117696 
LYXOR MSCI USA TRN ETF 	Amundi Luxembourg S.A. 	LU0392495700 
LYXOR MSCI WATER ESG FILTERED (DR) ETF 	Amundi Asset Management 	FR0010527275 
LYXOR MSCI WLD ESG LDRSEXTRDRETF 	Amundi Asset Management 	LU1799934903 
LYXOR MSCI WLD ESG LDRSEXTRDRETF 	Amundi Asset Management 	LU1792117779 
LYXOR MSCI WORLD CLIMATE CHANGE (DR) ETF 	Amundi Asset Management 	LU2056739464 
LYXOR MSCI WORLD ETF 	Amundi Asset Management 	FR0011660927 
LYXOR MSCI WORLD ETF 	Amundi Asset Management 	FR0010315770 
LYXOR MSCI WORLD TRN ETF 	Amundi Luxembourg S.A. 	LU0392494562 
LYXOR NASDAQ 100 ETF 	Amundi Asset Management 	LU2197908721 
LYXOR NASDAQ-100 DAILY 2X LEVERAGED ETF 	Amundi Asset Management 	FR0010342592 
LYXOR NET ZERO 2050S&P500 CLMTETF 	Amundi Asset Management 	LU2198883410 
LYXOR NYSE ARCA GOLD BUGS ETF 	Amundi Luxembourg S.A. 	LU0488317701 
LYXOR PAN AFRICA ETF 	Amundi Asset Management 	LU1287022708 
LYXOR PORTFOLIO STRATEGY DFNSV ETF 	Amundi Luxembourg S.A. 	DE000ETF7029 
LYXOR PORTFOLIO STRATEGY ETF 	Amundi Luxembourg S.A. 	DE000ETF7011 
LYXOR PORTFOLIO STRATEGY OFFNSV ETF 	Amundi Luxembourg S.A. 	DE000ETF7037 
LYXOR S&P 500 DAILY (-2X) INVERSE ETF 	Amundi Asset Management 	LU1327051279 
LYXOR S&P 500 ETF 	Amundi Asset Management 	LU0959211243 
LYXOR S&P 500 ETF 	Amundi Asset Management 	LU0496786657 
LYXOR S&P 500 ETF 	Amundi Asset Management 	LU0496786574 
LYXOR S&P 500 VIX FUTURES ENH ROLL ETF 	Amundi Asset Management 	LU0832435464 
LYXOR S&P EUROZ ESGDIVARSTCRTSDRUCITSETF 	Amundi Asset Management 	LU0959210278 
LYXOR SDAX ETF 	Amundi Luxembourg S.A. 	LU0603942888 
LYXOR SG GLOBAL QUALITY INCOME NTR ETF 	Amundi Asset Management 	LU0832436512 
LYXOR SHORTDAX TR ETF 	Amundi Luxembourg S.A. 	LU0603940916 
LYXOR SMART CASH 	Amundi Asset Management 	LU1190417599 
LYXOR SMART OVERNIGHT RETURN 	Amundi Asset Management 	LU2082999306 
LYXOR STOXX EUR 600 IDL GD & SVC ETF 	Amundi Asset Management 	LU2082997789 
LYXOR STOXX EUR 600 PNL & HHD GD ETF 	Amundi Asset Management 	LU2082998324 
LYXOR STOXX EURO 600 AUTO & PRT ETF 	Amundi Asset Management 	LU2082995908 
LYXOR STOXX EUROPE 600 BANKS ETF 	Amundi Asset Management 	LU2082996112 
LYXOR STOXX EUROPE 600 BANKS ETF 	Amundi Asset Management 	LU1834983477 
LYXOR STOXX EUROPE 600 BASIC RES ETF 	Amundi Asset Management 	LU2082996385 
LYXOR STOXX EUROPE 600 CHEMICALS ETF 	Amundi Asset Management 	LU2082996542 
LYXOR STOXX EUROPE 600 CON & MTL ETF 	Amundi Asset Management 	LU2082996898 
LYXOR STOXX EUROPE 600 FIN SVC ETF 	Amundi Asset Management 	LU2082997193 
LYXOR STOXX EUROPE 600 FOOD & BEV ETF 	Amundi Asset Management 	LU2082997359 
LYXOR STOXX EUROPE 600 HEALTHCARE ETF 	Amundi Asset Management 	LU2082997516 
LYXOR STOXX EUROPE 600 HEALTHCARE ETF 	Amundi Asset Management 	LU1834986900 
LYXOR STOXX EUROPE 600 INSURANCE ETF 	Amundi Asset Management 	LU2082997946 
LYXOR STOXX EUROPE 600 MEDIA ETF 	Amundi Asset Management 	LU2082995734 
LYXOR STOXX EUROPE 600 OIL & GAS ETF 	Amundi Asset Management 	LU2082998167 
LYXOR STOXX EUROPE 600 REAL ESTATE ETF 	Amundi Luxembourg S.A. 	LU1812091194 
LYXOR STOXX EUROPE 600 RETAIL ETF 	Amundi Asset Management 	LU2082998670 
LYXOR STOXX EUROPE 600 TECHNOLOGY ETF 	Amundi Asset Management 	LU2082998837 
LYXOR STOXX EUROPE 600 TEL ETF 	Amundi Asset Management 	LU2082999058 
LYXOR STOXX EUROPE 600 TRAVEL & LSR ETF 	Amundi Asset Management 	LU2082999132 
LYXOR STOXX EUROPE 600 UTILITIES ETF 	Amundi Asset Management 	LU2082999215 
LYXOR STOXX EUROPE SELECT DIV 30 ETF 	Amundi Asset Management 	LU1812092168 
LYXOR SWITZERLAND TITANS 30 ETF 	Amundi Luxembourg S.A. 	LU0392496427 
LYXOR US$ 10Y INFLATION EXPECTATIONS ETF 	Amundi Asset Management 	LU1390062831 
LYXOR UTLGDTERGTFTMT25+YDR ETF 	Amundi Asset Management 	LU1686832194 
MARKET ACCESS NYSE ARCA GOLDBUGS ETF 	FundRock Management Company S.A. 	LU0259322260 
MEDICAL CANNABIS AND WELLNESS ETF 	HANetf Management Ltd. 	IE00BG5J1M21 
MULTI UNITS LUX-LYXOR EURO FL RT NOTEETF 	Amundi Asset Management 	LU1829218319 
OSSIAM EUROPE ESG MACHINE LEARNING 	Ossiam 	LU0599612842 
OSSIAM SHILLER BARCLAYS CAPEEURSEVAL TR 	Ossiam 	LU1079842321 
OSSIAM SHILLER BCLY CAPE US SECT VAL TR 	Ossiam 	LU1079841273 
R.U.I.R.P.CA. ETFDLA 	Davy Global Fund Management Ltd. 	IE000QRNAC66 
RIZE CYBERSECURITY DATA PRIVACY ETF 	Davy Global Fund Management Ltd. 	IE00BJXRZJ40 
RIZE DIGITAL PAYMENTS ECONOMY ETF 	Davy Global Fund Management Ltd. 	IE00BLRPRQ96 
RIZE EDUCATION TECH AND DGTL LRNNG ETF 	Davy Global Fund Management Ltd. 	IE00BLRPQJ54 
RIZE ENVIRONMENTAL IMPACT 100 ETF 	Davy Global Fund Management Ltd. 	IE00BLRPRR04 
RIZE MEDICAL CANNABIS AND LIFE SCI ETF 	Davy Global Fund Management Ltd. 	IE00BJXRZ273 
RIZE SUSTAINABLE FUTURE OF FOOD ETF 	Davy Global Fund Management Ltd. 	IE00BLRPQH31 
RIZEEMIECOMETF DLA 	Davy Global Fund Management Ltd. 	IE000HJV1VH3 
SOLAR ENERGY ETF 	HANetf Management Ltd. 	IE00BMFNWC33 
SPDR BLMBRG 0-3 YR EUR CORP BD ETF 	State Street Global Advisors Europe Limited 	IE00BC7GZW19 
SPDR BLMBRG 0-5 YR STLG CORP B ETF 	State Street Global Advisors Europe Limited 	IE00BCBJF711 
SPDR BLMBRG 1-10 YR US CORP BDETF 	State Street Global Advisors Europe Limited 	IE00BYV12Y75 
SPDR BLMBRG 1-3 YR EUR GOVT BDETF 	State Street Global Advisors Europe Limited 	IE00B6YX5F63 
SPDR BLMBRG 1-3 YR US TRS BD ETF 	State Street Global Advisors Europe Limited 	IE00BC7GZJ81 
SPDR BLMBRG 1-5 YR GILT ETF 	State Street Global Advisors Europe Limited 	IE00B6YX5K17 
SPDR BLMBRG 10+ YR EUR GOVT BD ETF 	State Street Global Advisors Europe Limited 	IE00BYSZ6062 
SPDR BLMBRG 10+ YR US CORP BD ETF 	State Street Global Advisors Europe Limited 	IE00BZ0G8860 
SPDR BLMBRG 15+ YR GILT ETF 	State Street Global Advisors Europe Limited 	IE00B6YX5L24 
SPDR BLMBRG 3-7 YR US TRS BD ETF 	State Street Global Advisors Europe Limited 	IE00BYSZ5R67 
SPDR BLMBRG 7-10 YR US TRS BD ETF 	State Street Global Advisors Europe Limited 	IE00BYSZ5T81 
SPDR BLMBRG EMLCLBD$BASECCYHDGTO ETFACC 	State Street Global Advisors Europe Limited 	IE00B4613386 
SPDR BLMBRG EMLCLBD$BASECCYHDGTO ETFACC 	State Street Global Advisors Europe Limited 	IE00BFWFPY67 
SPDR BLMBRG EUR AGGT BD ETF 	State Street Global Advisors Europe Limited 	IE00B41RYL63 
SPDR BLMBRG EUR CORP BD ETF 	State Street Global Advisors Europe Limited 	IE00B3T9LM79 
SPDR BLMBRG EUR HY BD ETF 	State Street Global Advisors Europe Limited 	IE00B6YX5M31 
SPDR BLMBRG EURO GOVERNMENT BD ETF ACC 	State Street Global Advisors Europe Limited 	IE00B3S5XW04 
SPDR BLMBRG GLB AGGR BD USD HDG ETF ACC 	State Street Global Advisors Europe Limited 	IE00B43QJJ40 
SPDR BLMBRG GLB AGGR BD USD HDG ETF ACC 	State Street Global Advisors Europe Limited 	IE00BF1QPL78 
SPDR BLMBRG SASB US HI YLD CORP ESG ETF 	State Street Global Advisors Europe Limited 	IE00B99FL386 
SPDR BLMBRG US AGGT BD ETF 	State Street Global Advisors Europe Limited 	IE00B459R192 
SPDR BLMBRG US TIPS ETF 	State Street Global Advisors Europe Limited 	IE00BZ0G8977 
SPDR BLMBRG US TRS BD ETF 	State Street Global Advisors Europe Limited 	IE00B44CND37 
SPDR BLOOM.1-3M.T-B.A 	State Street Global Advisors Europe Limited 	IE00BJXRT698 
SPDR BLOOMBERG SASB EURO CORP ESG ETF 	State Street Global Advisors Europe Limited 	IE00BLF7VW10 
SPDR BLOOMBERG SASB U.S. CORP ESG ETF 	State Street Global Advisors Europe Limited 	IE00BLF7VX27 
SPDR DOW JONES GLOBAL REAL ESTATE ETF 	State Street Global Advisors Europe Limited 	IE00B8GF1M35 
SPDR DOW JONES GLOBAL REAL ESTATE ETF 	State Street Global Advisors Europe Limited 	IE00BH4GR342 
SPDR EURO STOXX LOW VOLATILITY ETF 	State Street Global Advisors Europe Limited 	IE00BFTWP510 
SPDR FTSE EPRA EUROPE EX UK REL EST ETF 	State Street Global Advisors Europe Limited 	IE00BSJCQV56 
SPDR FTSE UK ALL SHARE ETF 	State Street Global Advisors Europe Limited 	IE00B7452L46 
SPDR MSCI ACWI ETF 	State Street Global Advisors Europe Limited 	IE00B44Z5B48 
SPDR MSCI ACWI ETF 	State Street Global Advisors Europe Limited 	IE00BF1B7389 
SPDR MSCI ACWI IMI UCITS ETF 	State Street Global Advisors Europe Limited 	IE00B3YLTY66 
SPDR MSCI EM ASIA ETF 	State Street Global Advisors Europe Limited 	IE00B466KX20 
SPDR MSCI EMERGING MARKETS ETF 	State Street Global Advisors Europe Limited 	IE00B469F816 
SPDR MSCI EMERGING MARKETS SMALLCAP ETF 	State Street Global Advisors Europe Limited 	IE00B48X4842 
SPDR MSCI EMU ETF 	State Street Global Advisors Europe Limited 	IE00B910VR50 
SPDR MSCI EUROPE COMMUNICATION SVCS ETF 	State Street Global Advisors Europe Limited 	IE00BKWQ0N82 
SPDR MSCI EUROPE CONSUMER DISCRET ETF 	State Street Global Advisors Europe Limited 	IE00BKWQ0C77 
SPDR MSCI EUROPE CONSUMER STAPLES ETF 	State Street Global Advisors Europe Limited 	IE00BKWQ0D84 
SPDR MSCI EUROPE ENERGY ETF 	State Street Global Advisors Europe Limited 	IE00BKWQ0F09 
SPDR MSCI EUROPE ETF 	State Street Global Advisors Europe Limited 	IE00BKWQ0Q14 
SPDR MSCI EUROPE FINANCIALS ETF 	State Street Global Advisors Europe Limited 	IE00BKWQ0G16 
SPDR MSCI EUROPE HEALTH CARE ETF 	State Street Global Advisors Europe Limited 	IE00BKWQ0H23 
SPDR MSCI EUROPE INDUSTRIALS ETF 	State Street Global Advisors Europe Limited 	IE00BKWQ0J47 
SPDR MSCI EUROPE MATERIALS ETF 	State Street Global Advisors Europe Limited 	IE00BKWQ0L68 
SPDR MSCI EUROPE SM CAP VAL WTD ETF 	State Street Global Advisors Europe Limited 	IE00BSPLC298 
SPDR MSCI EUROPE SMALL CAP ETF 	State Street Global Advisors Europe Limited 	IE00BKWQ0M75 
SPDR MSCI EUROPE TECHNOLOGY ETF 	State Street Global Advisors Europe Limited 	IE00BKWQ0K51 
SPDR MSCI EUROPE UTILITIES ETF 	State Street Global Advisors Europe Limited 	IE00BKWQ0P07 
SPDR MSCI JAPAN ETF 	State Street Global Advisors Europe Limited 	IE00BZ0G8C04 
SPDR MSCI USA SMALL CAP VAL WTD ETF 	State Street Global Advisors Europe Limited 	IE00BSPLC413 
SPDR MSCI WORLD COMMUNICATION SVCS ETF 	State Street Global Advisors Europe Limited 	IE00BYTRRG40 
SPDR MSCI WORLD ENERGY ETF 	State Street Global Advisors Europe Limited 	IE00BYTRR863 
SPDR MSCI WORLD ETF 	State Street Global Advisors Europe Limited 	IE00BFY0GT14 
SPDR MSCI WORLD FINANCIALS ETF 	State Street Global Advisors Europe Limited 	IE00BYTRR970 
SPDR MSCI WORLD HEALTH CARE ETF 	State Street Global Advisors Europe Limited 	IE00BYTRRB94 
SPDR MSCI WORLD INDUSTRIALS ETF 	State Street Global Advisors Europe Limited 	IE00BYTRRC02 
SPDR MSCI WORLD MATERIALS ETF 	State Street Global Advisors Europe Limited 	IE00BYTRRF33 
SPDR MSCI WORLD SMALL CAP ETF 	State Street Global Advisors Europe Limited 	IE00BCBJG560 
SPDR MSCI WORLD UTILITIES ETF 	State Street Global Advisors Europe Limited 	IE00BYTRRH56 
SPDR RUSSELL 2000 US SMALL CAP ETF 	State Street Global Advisors Europe Limited 	IE00BJ38QD84 
SPDR S&P 400 US MID CAP ETF 	State Street Global Advisors Europe Limited 	IE00B4YBJ215 
SPDR S&P 500 ESG SCREENED ETF 	State Street Global Advisors Europe Limited 	IE00BH4GPZ28 
SPDR S&P 500 ETF 	State Street Global Advisors Europe Limited 	IE00B6YX5C33 
SPDR S&P 500 ETF 	State Street Global Advisors Europe Limited 	IE00BYYW2V44 
