Name	Emittent	ISIN
ISHARES GOVT BOND 0-1YR ETF 	BlackRock Asset Management Ireland Ltd. 	IE00B3FH7618 
ISHARES GOVT BOND 1-3YR ETF 	BlackRock Asset Management Ireland Ltd. 	IE00B14X4Q57 
ISHARES GOVT BOND 1-3YR ETF EUR ACC 	BlackRock Asset Management Ireland Ltd. 	IE00B3VTMJ91 
ISHARES GOVT BOND 10-15YR ETF 	BlackRock Asset Management Ireland Ltd. 	IE00B4WXJH41 
ISHARES GOVT BOND 15-30YR ETF 	BlackRock Asset Management Ireland Ltd. 	IE00B1FZS913 
ISHARES GOVT BOND 3-5YR ETF 	BlackRock Asset Management Ireland Ltd. 	IE00B1FZS681 
ISHARES GOVT BOND 3-7YR ETF 	BlackRock Asset Management Ireland Ltd. 	IE00B3VTML14 
ISHARES GOVT BOND 5-7YR ETF 	BlackRock Asset Management Ireland Ltd. 	IE00B4WXJG34 
ISHARES GOVT BOND 7-10YR ETF 	BlackRock Asset Management Ireland Ltd. 	IE00B1FZS806 
ISHARES GOVT BOND 7-10YR ETF EUR ACC 	BlackRock Asset Management Ireland Ltd. 	IE00B3VTN290 
ISHARES GOVT BOND CLIMATE ETF 	BlackRock Asset Management Ireland Ltd. 	IE00BLDGH553 
ISHARES GOVT BOND CLIMATE ETF 	BlackRock Asset Management Ireland Ltd. 	IE00BLDGH447 
ISHARES GREEN BOND ETF 	BlackRock Asset Management Ireland Ltd. 	IE00BMDBMN04 
ISHARES HIGH YIELD CORPBD ETF 	BlackRock Asset Management Ireland Ltd. 	IE00B66F4759 
ISHARES INFLAT LNKD GOVTBD ETF 	BlackRock Asset Management Ireland Ltd. 	IE00B0M62X26 
ISHARES ULTRASHORT BOND ESG ETF 	BlackRock Asset Management Ireland Ltd. 	IE00BJP26D89 
ISHARES ULTRASHORT BOND ETF 	BlackRock Asset Management Ireland Ltd. 	IE00BCRY6557 
ISHARES $ CORP BOND 0-3YR ESG UCITS ETF 	BlackRock Asset Management Ireland Ltd. 	IE00BZ048579 
ISHARES $ CORP BOND ESG ETF 	BlackRock Asset Management Ireland Ltd. 	IE00BK4W7N32 
ISHARES $ CORP BOND ESG ETF 	BlackRock Asset Management Ireland Ltd. 	IE00BH4G7D40 
ISHARES $ CORP BOND ETF 	BlackRock Asset Management Ireland Ltd. 	IE0032895942 
ISHARES $ CORP BOND INTR RT H ETF 	BlackRock Asset Management Ireland Ltd. 	IE00BCLWRB83 
ISHARES $ DEVELOPMENT BANK BDS ETF (ACC) 	BlackRock Asset Management Ireland Ltd. 	IE00BMCZLH06 
ISHARES $ FLOATING RATE BOND ETF 	BlackRock Asset Management Ireland Ltd. 	IE00BZ048462 
ISHARES $ FLOATING RATE BOND ETF 	BlackRock Asset Management Ireland Ltd. 	IE00BF11F458 
ISHARES $ HIGH YIELD CORP BOND ESG ETF 	BlackRock Asset Management Ireland Ltd. 	IE00BMDFDY08 
ISHARES $ HIGH YLD CORP BD ETF 	BlackRock Asset Management Ireland Ltd. 	IE00BF3N7102 
ISHARES $ HIGH YLD CORP BD ETF 	BlackRock Asset Management Ireland Ltd. 	IE00B4PY7Y77 
ISHARES $ SHORT DUR CORP BD ETF 	BlackRock Asset Management Ireland Ltd. 	IE00BCRY5Y77 
ISHARES $ SHORT DUR HY CORPBD ETF 	BlackRock Asset Management Ireland Ltd. 	IE00BCRY6003 
ISHARES $ TIPS 0-5 ETF 	BlackRock Asset Management Ireland Ltd. 	IE00BDQYWQ65 
ISHARES $ TIPS ETF 	BlackRock Asset Management Ireland Ltd. 	IE00BDZVH966 
ISHARES $ TIPS ETF 	BlackRock Asset Management Ireland Ltd. 	IE00B1FZSC47 
ISHARES $ TREASURY BD 1-3Y ETF 	BlackRock Asset Management Ireland Ltd. 	IE00BDFK1573 
ISHARES $ TREASURY BD 1-3Y ETF 	BlackRock Asset Management Ireland Ltd. 	IE00B14X4S71 
ISHARES $ TREASURY BD 1-3Y ETF B 	BlackRock Asset Management Ireland Ltd. 	IE00B3VWN179 
ISHARES $ TREASURY BD 20+Y ETF 	BlackRock Asset Management Ireland Ltd. 	IE00BSKRJZ44 
ISHARES $ TREASURY BD 20+Y ETF 	BlackRock Asset Management Ireland Ltd. 	IE00BD8PGZ49 
ISHARES $ TREASURY BD 3-7Y ETF 	BlackRock Asset Management Ireland Ltd. 	IE00BGPP6473 
ISHARES $ TREASURY BD 3-7Y ETF 	BlackRock Asset Management Ireland Ltd. 	IE00B3VWN393 
ISHARES $ TREASURY BD 7-10Y ETF 	BlackRock Asset Management Ireland Ltd. 	IE00BGPP6697 
ISHARES $ TREASURY BD 7-10Y ETF 	BlackRock Asset Management Ireland Ltd. 	IE00B1FZS798 
ISHARES $ TREASURY BD 7-10Y ETF USD ACC 	BlackRock Asset Management Ireland Ltd. 	IE00B3VWN518 
ISHARES $ ULTRASHORT BOND ETF 	BlackRock Asset Management Ireland Ltd. 	IE00BCRY6227 
ISHARES AEX ETF 	BlackRock Asset Management Ireland Ltd. 	IE00B0M62Y33 
ISHARES AGEING POPULATION ETF 	BlackRock Asset Management Ireland Ltd. 	IE00BYZK4669 
ISHARES AGRIBUSINESS ETF 	BlackRock Asset Management Ireland Ltd. 	IE00B6R52143 
ISHARES ASIA PACIFIC DIVIDEND ETF 	BlackRock Asset Management Ireland Ltd. 	IE00B14X4T88 
ISHARES ASIA PROPERTY YIELD ETF 	BlackRock Asset Management Ireland Ltd. 	IE00B1FZS244 
ISHARES ATX ETF (DE) 	BlackRock Asset Management Deutschland AG (KVG) 	DE000A0D8Q23 
ISHARES AUTOMATION&ROBOTICS ETF 	BlackRock Asset Management Ireland Ltd. 	IE00BYZK4552 
ISHARES AUTOMATION&ROBOTICS ETF 	BlackRock Asset Management Ireland Ltd. 	IE00BYWZ0333 
ISHARES BRIC 50 ETF 	BlackRock Asset Management Ireland Ltd. 	IE00B1W57M07 
ISHARES CHINA CNY BOND ETF 	BlackRock Asset Management Ireland Ltd. 	IE00BYPC1H27 
ISHARES CHINA LARGE CAP ETF 	BlackRock Asset Management Ireland Ltd. 	IE00B02KXK85 
ISHARES CORE CORP BOND ETF 	BlackRock Asset Management Ireland Ltd. 	IE00BF11F565 
ISHARES CORE CORP BOND ETF 	BlackRock Asset Management Ireland Ltd. 	IE00B3F81R35 
ISHARES CORE GOVT BOND ETF 	BlackRock Asset Management Ireland Ltd. 	IE00B4WXJJ64 
ISHARES CORE DAX ETF (DE) 	BlackRock Asset Management Deutschland AG (KVG) 	DE0005933931 
ISHARES CORE EURO STOXX 50 ETF 	BlackRock Asset Management Ireland Ltd. 	IE00B53L3W79 
ISHARES CORE EURO STOXX 50 ETF (DE) 	BlackRock Asset Management Deutschland AG (KVG) 	DE0005933956 
ISHARES CORE FTSE 100 ETF 	BlackRock Asset Management Ireland Ltd. 	IE0005042456 
ISHARES CORE GLOBAL AGGREGATE BOND ETF 	BlackRock Asset Management Ireland Ltd. 	IE00BF540Y54 
ISHARES CORE GLOBAL AGGREGATE BOND ETF 	BlackRock Asset Management Ireland Ltd. 	IE00BDBRDM35 
ISHARES CORE GLOBAL AGGREGATE BOND ETF 	BlackRock Asset Management Ireland Ltd. 	IE00B3F81409 
ISHARES CORE MSCI EM IMI ETF 	BlackRock Asset Management Ireland Ltd. 	IE00BKM4GZ66 
ISHARES CORE MSCI EM IMI ETF 	BlackRock Asset Management Ireland Ltd. 	IE00BD45KH83 
ISHARES CORE MSCI EMU UCITS ETF 	BlackRock Asset Management Ireland Ltd. 	IE00B53QG562 
ISHARES CORE MSCI EUROPE ETF (ACC) 	BlackRock Asset Management Ireland Ltd. 	IE00B4K48X80 
ISHARES CORE MSCI EUROPE UCITS ETF 	BlackRock Asset Management Ireland Ltd. 	IE00B1YZSC51 
ISHARES CORE MSCI JAPAN IMI ETF 	BlackRock Asset Management Ireland Ltd. 	IE00B4L5YX21 
ISHARES CORE MSCI PAC EX-JPN ETF 	BlackRock Asset Management Ireland Ltd. 	IE00B52MJY50 
ISHARES CORE MSCI WORLD ETF 	BlackRock Asset Management Ireland Ltd. 	IE00BKBF6H24 
ISHARES CORE MSCI WORLD ETF 	BlackRock Asset Management Ireland Ltd. 	IE00B4L5Y983 
ISHARES CORE S&P 500 ETF 	BlackRock Asset Management Ireland Ltd. 	IE00B5BMR087 
ISHARES CORE S&P 500 ETF USD DIST 	BlackRock Asset Management Ireland Ltd. 	IE0031442068 
ISHARES CORE UK GILTS ETF 	BlackRock Asset Management Ireland Ltd. 	IE00B1FZSB30 
ISHARES DAX ESG ETF (DE) 	BlackRock Asset Management Deutschland AG (KVG) 	DE000A0Q4R69 
ISHARES DEV MKTS PRPTY YLD ETF 	BlackRock Asset Management Ireland Ltd. 	IE00B1FZS350 
ISHARES DIGITAL SECURITY ETF 	BlackRock Asset Management Ireland Ltd. 	IE00BG0J4C88 
ISHARES DIGITAL SECURITY ETF 	BlackRock Asset Management Ireland Ltd. 	IE00BG0J4841 
ISHARES DIGITALISATION ETF 	BlackRock Asset Management Ireland Ltd. 	IE00BYZK4883
ISHARES DIVDAX ETF (DE) 	BlackRock Asset Management Deutschland AG (KVG) 	DE0002635273 
ISHARES DJ ASIA PACIFIC SEL DIVI 50 (DE) 	BlackRock Asset Management Deutschland AG (KVG) 	DE000A0H0744 
ISHARES DJ CHINA OFFSHORE 50 ETF (DE) 	BlackRock Asset Management Deutschland AG (KVG) 	DE000A0F5UE8 
ISHARES DJ EURZNE SUSTAINBLTYSCRNED (DE) 	BlackRock Asset Management Deutschland AG (KVG) 	DE000A0F5UG3 
ISHARES DJ GLOBAL TITANS 50 ETF (DE) 	BlackRock Asset Management Deutschland AG (KVG) 	DE0006289382 
ISHARES DJ INDUSTRIAL AVERAGE (DE) 	BlackRock Asset Management Deutschland AG (KVG) 	DE0006289390 
ISHARES DJ US SELECT DIVIDEND (DE) 	BlackRock Asset Management Deutschland AG (KVG) 	DE000A0D8Q49 
ISHARES DOW JONES GLB SUST SCRN ETF 	BlackRock Asset Management Ireland Ltd. 	IE00B57X3V84 
ISHARES DOW JONES INDUST AVG ETF 	BlackRock Asset Management Ireland Ltd. 	IE00B53L4350 
ISHARES EB.REXX GOVTGER 1.5-2.5YR (DE) 	BlackRock Asset Management Deutschland AG (KVG) 	DE0006289473 
ISHARES EB.REXX GOVTGER 10.5+YR (DE) 	BlackRock Asset Management Deutschland AG (KVG) 	DE000A0D8Q31 
ISHARES EB.REXX GOVTGER 2.5-5.5YR (DE) 	BlackRock Asset Management Deutschland AG (KVG) 	DE0006289481 
ISHARES EB.REXX GOVTGER 5.5-10.5YR (DE) 	BlackRock Asset Management Deutschland AG (KVG) 	DE0006289499 
ISHARES EB.REXX GOVTGER ETF (DE) 	BlackRock Asset Management Deutschland AG (KVG) 	DE0006289465 
ISHARES EB.REXXGOVERNMENT GERMANY 0-1YR 	BlackRock Asset Management Deutschland AG (KVG) 	DE000A0Q4RZ9 
ISHARES EDGE MSCI EM MINI VOL ETF 	BlackRock Asset Management Ireland Ltd. 	IE00B8KGV557 
ISHARES EDGE MSCI EUROPE MIN VOL ESG ETF 	BlackRock Asset Management Ireland Ltd. 	IE00BKVL7D31 
ISHARES EDGE MSCI EURP MINI VOL ETF 	BlackRock Asset Management Ireland Ltd. 	IE00B86MWN23 
ISHARES EDGE MSCI EURP MLTFCTR ETF 	BlackRock Asset Management Ireland Ltd. 	IE00BZ0PKV06 
ISHARES EDGE MSCI EURP MOM FCTR ETF 	BlackRock Asset Management Ireland Ltd. 	IE00BQN1K786 
ISHARES EDGE MSCI EURP QUALFCTR ETF 	BlackRock Asset Management Ireland Ltd. 	IE00BQN1K562 
ISHARES EDGE MSCI EURP SZ FCTR ETF 	BlackRock Asset Management Ireland Ltd. 	IE00BQN1KC32 
ISHARES EDGE MSCI EURP VAL FCTR ETF 	BlackRock Asset Management Ireland Ltd. 	IE00BQN1K901 
ISHARES EDGE MSCI USA MIN VOL ESG ETF 	BlackRock Asset Management Ireland Ltd. 	IE00BKVL7331 
ISHARES EDGE MSCI USA MLTFCT ETF 	BlackRock Asset Management Ireland Ltd. 	IE00BZ0PKS76 
ISHARES EDGE MSCI USA MOMENTUM FCTR ETF 	BlackRock Asset Management Ireland Ltd. 	IE00BD1F4N50 
ISHARES EDGE MSCI USA QUALITY FACTOR ETF 	BlackRock Asset Management Ireland Ltd. 	IE00BD1F4L37 
ISHARES EDGE MSCI USA SIZE FACTOR ETF 	BlackRock Asset Management Ireland Ltd. 	IE00BD1F4K20 
ISHARES EDGE MSCI USA VALUE FACTOR ETF 	BlackRock Asset Management Ireland Ltd. 	IE00BD1F4M44 
ISHARES EDGE MSCI WLD MIN VOL ETF 	BlackRock Asset Management Ireland Ltd. 	IE00BYXPXL17 
ISHARES EDGE MSCI WLD MIN VOL ETF 	BlackRock Asset Management Ireland Ltd. 	IE00BMCZLJ20 
ISHARES EDGE MSCI WLD MIN VOL ETF 	BlackRock Asset Management Ireland Ltd. 	IE00B8FHGS14 
ISHARES EDGE MSCI WLD MLTFCT ETF 	BlackRock Asset Management Ireland Ltd. 	IE00BZ0PKT83 
ISHARES EDGE MSCI WLD MLTFCT ETF 	BlackRock Asset Management Ireland Ltd. 	IE00BYXPXK00 
ISHARES EDGE MSCI WLD MOM FCTR ETF 	BlackRock Asset Management Ireland Ltd. 	IE00BP3QZ825 
ISHARES EDGE MSCI WLD QUAL FCTR ETF 	BlackRock Asset Management Ireland Ltd. 	IE00BP3QZ601 
ISHARES EDGE MSCI WLD SIZE FCTR ETF 	BlackRock Asset Management Ireland Ltd. 	IE00BP3QZD73 
ISHARES EDGE MSCI WLD VAL FCTR ETF 	BlackRock Asset Management Ireland Ltd. 	IE00BP3QZB59 
ISHARES EDGE MSCI WORLD MIN VOL ESG ETF 	BlackRock Asset Management Ireland Ltd. 	IE00BKVL7778 
ISHARES EDGE S&P 500 MIN VOL ETF 	BlackRock Asset Management Ireland Ltd. 	IE00BYX8XD24 
ISHARES EDGE S&P 500 MIN VOL ETF 	BlackRock Asset Management Ireland Ltd. 	IE00B6SPMN59 
ISHARES ELECTRIC VHCL AND DRVNG TECH ETF 	BlackRock Asset Management Ireland Ltd. 	IE00BGL86Z12 
ISHARES EM ASIA LCL GOVT BD ETF 	BlackRock Asset Management Ireland Ltd. 	IE00B6QGFW01 
ISHARES EM DIVIDEND ETF 	BlackRock Asset Management Ireland Ltd. 	IE00B652H904 
ISHARES EM INFRASTRUCTURE ETF 	BlackRock Asset Management Ireland Ltd. 	IE00B2NPL135 
ISHARES EURO DIVIDEND ETF 	BlackRock Asset Management Ireland Ltd. 	IE00B0M62S72 
ISHARES EURO GOVT BD CP 1.5-10.5YR (DE) 	BlackRock Asset Management Deutschland AG (KVG) 	DE000A0H0785 
ISHARES EURO STOXX (DE) 	BlackRock Asset Management Deutschland AG (KVG) 	DE000A0D8Q07 
ISHARES EURO STOXX 50 ETF 	BlackRock Asset Management Ireland Ltd. 	IE0008471009 
ISHARES EURO STOXX BANKS 30-15 ETF (DE) 	BlackRock Asset Management Deutschland AG (KVG) 	DE0006289309 
ISHARES EURO STOXX MID ETF 	BlackRock Asset Management Ireland Ltd. 	IE00B02KXL92 
ISHARES EURO STOXX SELECT DIV 30 (DE) 	BlackRock Asset Management Deutschland AG (KVG) 	DE0002635281 
ISHARES EURO STOXX SMALL ETF 	BlackRock Asset Management Ireland Ltd. 	IE00B02KXM00 
ISHARES EURO TOTAL MKT GR LG ETF 	BlackRock Asset Management Ireland Ltd. 	IE00B0M62V02 
ISHARES EUROPEAN PRPTY YLD ETF 	BlackRock Asset Management Ireland Ltd. 	IE00BGDQ0L74 
ISHARES EUROPEAN PRPTY YLD ETF 	BlackRock Asset Management Ireland Ltd. 	IE00B0M63284 
ISHARES FALLEN ANGELS HY CORPBD ETF 	BlackRock Asset Management Ireland Ltd. 	IE00BYM31M36 
ISHARES FTSE 100 ETF 	BlackRock Asset Management Ireland Ltd. 	IE00B53HP851 
ISHARES FTSE MIB ETF 	BlackRock Asset Management Ireland Ltd. 	IE00B1XNH568 
ISHARES FTSE MIB ETF (ACC) 	BlackRock Asset Management Ireland Ltd. 	IE00B53L4X51 
ISHARES GERMANY GOVT BOND ETF 	BlackRock Asset Management Ireland Ltd. 	IE00B5V94313 
ISHARES GLOBAL AAA-AA GOVT BD ETF 	BlackRock Asset Management Ireland Ltd. 	IE00B87G8S03 
ISHARES GLOBAL AGGREGATE BOND ESG ETF 	BlackRock Asset Management Ireland Ltd. 	IE000APK27S2 
ISHARES GLOBAL CLEAN ENERGY ETF 	BlackRock Asset Management Ireland Ltd. 	IE00B1XNHC34 
ISHARES GLOBAL CORP BOND ETF 	BlackRock Asset Management Ireland Ltd. 	IE00B7J7TB45 
ISHARES GLOBAL CORP BOND EURH ETF 	BlackRock Asset Management Ireland Ltd. 	IE00B9M6SJ31 
ISHARES GLOBAL GOVT BOND ETF 	BlackRock Asset Management Ireland Ltd. 	IE00B3F81K65 
ISHARES GLOBAL HY CORP BD ETF 	BlackRock Asset Management Ireland Ltd. 	IE00BJSFR200 
ISHARES GLOBAL HY CORP BD ETF 	BlackRock Asset Management Ireland Ltd. 	IE00B74DQ490 
ISHARES GLOBAL INFL LNKD GOVBD ETF 	BlackRock Asset Management Ireland Ltd. 	IE00BKPT2S34 
ISHARES GLOBAL INFL LNKD GOVBD ETF 	BlackRock Asset Management Ireland Ltd. 	IE00B3B8PX14 
ISHARES GLOBAL INFRASTRUCTURE ETF 	BlackRock Asset Management Ireland Ltd. 	IE00B1FZS467 
ISHARES GLOBAL TIMBER&FORESTRY ETF 	BlackRock Asset Management Ireland Ltd. 	IE00B27YCF74 
ISHARES GLOBAL WATER ETF 	BlackRock Asset Management Ireland Ltd. 	IE00B1TXK627 
ISHARES GOLD PRODUCERS ETF 	BlackRock Asset Management Ireland Ltd. 	IE00B6R52036 
ISHARES HEALTHCARE INNOV ETF 	BlackRock Asset Management Ireland Ltd. 	IE00BYZK4776 
ISHARES ITALY GOVT BOND ETF 	BlackRock Asset Management Ireland Ltd. 	IE00B7LW6Y90 
ISHARES JP MORGAN $ EM BOND ETF 	BlackRock Asset Management Ireland Ltd. 	IE00BYXYYK40 
ISHARES JP MORGAN $ EM BOND ETF 	BlackRock Asset Management Ireland Ltd. 	IE00BJ5JPH63 
ISHARES JP MORGAN $ EM BOND ETF 	BlackRock Asset Management Ireland Ltd. 	IE00B2NPKV68 
ISHARES JP MORGAN $ EM BOND EURH ETF 	BlackRock Asset Management Ireland Ltd. 	IE00B9M6RS56 
ISHARES JP MORGAN ESG $ EM BOND ETF 	BlackRock Asset Management Ireland Ltd. 	IE00BKP5L730 
ISHARES JP MORGAN ESG $ EM BOND ETF 	BlackRock Asset Management Ireland Ltd. 	IE00BDDRDW15 
ISHARES JPMORGAN $ EM CORP BOND ETF 	BlackRock Asset Management Ireland Ltd. 	IE00BKT1CS59 
ISHARES JPMORGAN $ EM CORP BOND ETF 	BlackRock Asset Management Ireland Ltd. 	IE00B6TLBW47 
ISHARES JPMORGAN EM LOCAL GOVT BOND ETF 	BlackRock Asset Management Ireland Ltd. 	IE00B5M4WH52 
ISHARES LISTED PRIVATE EQ ETF 	BlackRock Asset Management Ireland Ltd. 	IE00B1TXHL60 
ISHARES MDAX ETF (DE) 	BlackRock Asset Management Deutschland AG (KVG) 	DE000A2QP349 
ISHARES MDAX ETF (DE) 	BlackRock Asset Management Deutschland AG (KVG) 	DE0005933923 
ISHARES MSCI AC FAR EAST EXJPN ETF 	BlackRock Asset Management Ireland Ltd. 	IE00B0M63730 
ISHARES MSCI AC FAREAST EXJPN SC ETF 	BlackRock Asset Management Ireland Ltd. 	IE00B2QWDR12 
ISHARES MSCI ACWI ETF 	BlackRock Asset Management Ireland Ltd. 	IE00B6R52259 
ISHARES MSCI AUSTRALIA ETF 	BlackRock Asset Management Ireland Ltd. 	IE00B5377D42 
ISHARES MSCI BRAZIL ETF USD DIST 	BlackRock Asset Management Ireland Ltd. 	IE00B0M63516 
ISHARES MSCI CANADA ETF 	BlackRock Asset Management Ireland Ltd. 	IE00B52SF786 
ISHARES MSCI CHINA A ETF 	BlackRock Asset Management Ireland Ltd. 	IE00BQT3WG13 
ISHARES MSCI EM ASIA ETF 	BlackRock Asset Management Ireland Ltd. 	IE00B5L8K969 
ISHARES MSCI EM CONSUMER GR ETF 	BlackRock Asset Management Ireland Ltd. 	IE00BKM4H197 
ISHARES MSCI EM ESG ENHANCED ETF 	BlackRock Asset Management Ireland Ltd. 	IE00BHZPJ239 
ISHARES MSCI EM ETF 	BlackRock Asset Management Ireland Ltd. 	IE00B4L5YC18 
ISHARES MSCI EM ETF USD DIST 	BlackRock Asset Management Ireland Ltd. 	IE00B0M63177 
ISHARES MSCI EM IMI ESG SCREENED ETF 	BlackRock Asset Management Ireland Ltd. 	IE00BFNM3P36 
ISHARES MSCI EM IMI ESG SCREENED ETF 	BlackRock Asset Management Ireland Ltd. 	IE00BFNM3N12 
ISHARES MSCI EM LATIN AMER ETF 	BlackRock Asset Management Ireland Ltd. 	IE00B27YCK28 
ISHARES MSCI EM SMALL CAP ETF 	BlackRock Asset Management Ireland Ltd. 	IE00B3F81G20 
ISHARES MSCI EM SRI ETF 	BlackRock Asset Management Ireland Ltd. 	IE00BYVJRP78 
ISHARES MSCI EM SRI ETF 	BlackRock Asset Management Ireland Ltd. 	IE00BGDQ0T50 
ISHARES MSCI EMU ESG ENHANCED ETF 	BlackRock Asset Management Ireland Ltd. 	IE00BHZPJ015 
ISHARES MSCI EMU ESG ENHANCED ETF 	BlackRock Asset Management Ireland Ltd. 	IE00BHZPHZ28 
ISHARES MSCI EMU ESG SCREENED ETF 	BlackRock Asset Management Ireland Ltd. 	IE00BFNM3C07 
ISHARES MSCI EMU ESG SCREENED ETF 	BlackRock Asset Management Ireland Ltd. 	IE00BFNM3B99 
ISHARES MSCI EMU LARGE CAP ETF 	BlackRock Asset Management Ireland Ltd. 	IE00BCLWRF22 
ISHARES MSCI EMU MID CAP ETF 	BlackRock Asset Management Ireland Ltd. 	IE00BCLWRD08 
ISHARES MSCI EMU SMALL CAP ETF 	BlackRock Asset Management Ireland Ltd. 	IE00B3VWMM18 
ISHARES MSCI EUROPE CNSMR STPLS SEC ETF 	BlackRock Asset Management Ireland Ltd. 	IE00BMW42074 
ISHARES MSCI EUROPE ESG ENHANCED ETF 	BlackRock Asset Management Ireland Ltd. 	IE00BHZPJ783 
ISHARES MSCI EUROPE ESG ENHANCED ETF 	BlackRock Asset Management Ireland Ltd. 	IE00BHZPJ676 
ISHARES MSCI EUROPE ESG SCREENED ETF 	BlackRock Asset Management Ireland Ltd. 	IE00BFNM3F38 
ISHARES MSCI EUROPE ESG SCREENED ETF 	BlackRock Asset Management Ireland Ltd. 	IE00BFNM3D14 
ISHARES MSCI EUROPE EX-UK ETF 	BlackRock Asset Management Ireland Ltd. 	IE00B14X4N27 
ISHARES MSCI EUROPE INDUSTRIALS SEC ETF 	BlackRock Asset Management Ireland Ltd. 	IE00BMW42520 
ISHARES MSCI EUROPE MID CAP ETF 	BlackRock Asset Management Ireland Ltd. 	IE00BF20LF40 
ISHARES MSCI EUROPE QUAL DIV ETF EUR DIS 	BlackRock Asset Management Ireland Ltd. 	IE00BYYHSM20 
ISHARES MSCI EUROPE SRI ETF 	BlackRock Asset Management Ireland Ltd. 	IE00BGDPWW94 
ISHARES MSCI EUROPE SRI ETF 	BlackRock Asset Management Ireland Ltd. 	IE00B52VJ196 
ISHARES MSCI GLOBAL SEMICONDUCTORS ETF 	BlackRock Asset Management Ireland Ltd. 	IE000I8KRLL9 
ISHARES MSCI INDIA ETF 	BlackRock Asset Management Ireland Ltd. 	IE00BZCQB185 
ISHARES MSCI JAPAN ESG ENHANCED ETF 	BlackRock Asset Management Ireland Ltd. 	IE00BHZPJ452 
ISHARES MSCI JAPAN ESG ENHANCED ETF 	BlackRock Asset Management Ireland Ltd. 	IE00BHZPJ346 
ISHARES MSCI JAPAN ESG SCREENED ETF 	BlackRock Asset Management Ireland Ltd. 	IE00BFNM3M05 
ISHARES MSCI JAPAN ESG SCREENED ETF 	BlackRock Asset Management Ireland Ltd. 	IE00BFNM3L97 
ISHARES MSCI JAPAN ETF 	BlackRock Asset Management Ireland Ltd. 	IE00B53QDK08 
ISHARES MSCI JAPAN ETF USD DIST 	BlackRock Asset Management Ireland Ltd. 	IE00B02KXH56 
ISHARES MSCI JAPAN EUR HEDGED ETF 	BlackRock Asset Management Ireland Ltd. 	IE00B42Z5J44 
ISHARES MSCI JAPAN SMALL CAP ETF 	BlackRock Asset Management Ireland Ltd. 	IE00B2QWDY88 
ISHARES MSCI JAPAN SRI ETF 	BlackRock Asset Management Ireland Ltd. 	IE00BYX8XC17 
ISHARES MSCI JAPAN SRI EURH ETF 	BlackRock Asset Management Ireland Ltd. 	IE00BYVJRQ85 
ISHARES MSCI JAPAN USD HEDGED ETF 	BlackRock Asset Management Ireland Ltd. 	IE00BCLWRG39 
ISHARES MSCI KOREA ETF 	BlackRock Asset Management Ireland Ltd. 	IE00B5W4TY14 
ISHARES MSCI KOREA ETF DIST 	BlackRock Asset Management Ireland Ltd. 	IE00B0M63391 
ISHARES MSCI MEXICO CAPPED ETF 	BlackRock Asset Management Ireland Ltd. 	IE00B5WHFQ43 
ISHARES MSCI NORTH AMERICA ETF 	BlackRock Asset Management Ireland Ltd. 	IE00B14X4M10 
ISHARES MSCI PACIFIC EX-JPN ETF 	BlackRock Asset Management Ireland Ltd. 	IE00B4WXJD03 
ISHARES MSCI POLAND ETF 	BlackRock Asset Management Ireland Ltd. 	IE00B4M7GH52 
ISHARES MSCI SOUTH AFRICA ETF 	BlackRock Asset Management Ireland Ltd. 	IE00B52XQP83 
ISHARES MSCI TAIWAN ETF 	BlackRock Asset Management Ireland Ltd. 	IE00B0M63623 
ISHARES MSCI TURKEY ETF 	BlackRock Asset Management Ireland Ltd. 	IE00B1FZS574 
ISHARES MSCI UK ETF 	BlackRock Asset Management Ireland Ltd. 	IE00B539F030 
ISHARES MSCI UK SMALL CAP ETF 	BlackRock Asset Management Ireland Ltd. 	IE00B3VWLG82 
ISHARES MSCI USA ESG ENHANCED ETF 	BlackRock Asset Management Ireland Ltd. 	IE00BHZPJ908 
ISHARES MSCI USA ESG ENHANCED ETF 	BlackRock Asset Management Ireland Ltd. 	IE00BHZPJ890 
ISHARES MSCI USA ESG SCREENED ETF 	BlackRock Asset Management Ireland Ltd. 	IE00BFNM3H51 
ISHARES MSCI USA ESG SCREENED ETF 	BlackRock Asset Management Ireland Ltd. 	IE00BFNM3G45 
ISHARES MSCI USA ETF 	BlackRock Asset Management Ireland Ltd. 	IE00B52SFT06 
ISHARES MSCI USA QUALITY DIVIDEND ETF 	BlackRock Asset Management Ireland Ltd. 	IE00BKM4H312 
ISHARES MSCI USA SMALL CAP ETF 	BlackRock Asset Management Ireland Ltd. 	IE00B3VWM098 
ISHARES MSCI USA SRI ETF 	BlackRock Asset Management Ireland Ltd. 	IE00BZ173V67 
ISHARES MSCI USA SRI ETF 	BlackRock Asset Management Ireland Ltd. 	IE00BYVJRR92 
ISHARES MSCI WORLD CNSMR DISC SECT ETF 	BlackRock Asset Management Ireland Ltd. 	IE00BJ5JP212 
ISHARES MSCI WORLD CONSUMER STP SECT ETF 	BlackRock Asset Management Ireland Ltd. 	IE00BJ5JP329 
ISHARES MSCI WORLD ENERGY SECTOR ETF 	BlackRock Asset Management Ireland Ltd. 	IE00BJ5JP105 
ISHARES MSCI WORLD ESG ENHANCED ETF 	BlackRock Asset Management Ireland Ltd. 	IE00BHZPJ569 
ISHARES MSCI WORLD ESG ENHANCED ETF 	BlackRock Asset Management Ireland Ltd. 	IE00BG11HV38 
ISHARES MSCI WORLD ESG SCREENED ETF 	BlackRock Asset Management Ireland Ltd. 	IE00BFNM3K80 
ISHARES MSCI WORLD ESG SCREENED ETF 	BlackRock Asset Management Ireland Ltd. 	IE00BFNM3J75 
ISHARES MSCI WORLD ETF 	BlackRock Asset Management Ireland Ltd. 	IE00B0M62Q58 
ISHARES MSCI WORLD EUR HEDGED ETF 	BlackRock Asset Management Ireland Ltd. 	IE00B441G979 
ISHARES MSCI WORLD HEALTH CARE SECT ETF 	BlackRock Asset Management Ireland Ltd. 	IE00BJ5JNZ06 
ISHARES MSCI WORLD INFO TECH SECT ETF 	BlackRock Asset Management Ireland Ltd. 	IE00BJ5JNY98 
ISHARES MSCI WORLD MOMENTUM FAC ESG ETF 	BlackRock Asset Management Ireland Ltd. 	IE000L5NW549 
ISHARES MSCI WORLD QUAL DIV ETF 	BlackRock Asset Management Ireland Ltd. 	IE00BYYHSQ67 
ISHARES MSCI WORLD SMALL CAP ETF 	BlackRock Asset Management Ireland Ltd. 	IE00BF4RFH31 
ISHARES MSCI WORLD SRI ETF 	BlackRock Asset Management Ireland Ltd. 	IE00BYX2JD69 
ISHARES MSCI WORLD SRI ETF 	BlackRock Asset Management Ireland Ltd. 	IE00BMZ17W23 
ISHARES MSCI WORLD SRI ETF 	BlackRock Asset Management Ireland Ltd. 	IE00BDZZTM54 
ISHARES MSCI WORLD VALUE FACTOR ESG ETF 	BlackRock Asset Management Ireland Ltd. 	IE000H1H16W5 
ISHARES NASDAQ 100 ETF 	BlackRock Asset Management Ireland Ltd. 	IE00BYVQ9F29 
ISHARES NASDAQ 100 ETF 	BlackRock Asset Management Ireland Ltd. 	IE00B53SZB19 
ISHARES NASDAQ US BIOTECHNOLOGY ETF 	BlackRock Asset Management Ireland Ltd. 	IE00BYXG2H39 
ISHARES NASDAQ-100 ETF (DE) 	BlackRock Asset Management Deutschland AG (KVG) 	DE000A0F5UF5 
ISHARES NIKKEI 225 ETF 	BlackRock Asset Management Ireland Ltd. 	IE00B52MJD48 
ISHARES NIKKEI 225 ETF (DE) 	BlackRock Asset Management Deutschland AG (KVG) 	DE000A0H08D2 
ISHARES OIL & GAS EXPLR&PROD ETF 	BlackRock Asset Management Ireland Ltd. 	IE00B6R51Z18 
ISHARES PFANDBRIEFE ETF (DE) 	BlackRock Asset Management Deutschland AG (KVG) 	DE0002635265 
ISHARES S&P 500 CNSMR DISCR SECT ETF 	BlackRock Asset Management Ireland Ltd. 	IE00B4MCHD36 
ISHARES S&P 500 CNSMR STPLS SECT ETF 	BlackRock Asset Management Ireland Ltd. 	IE00B40B8R38 
ISHARES S&P 500 COMMUNICATION SECTOR ETF 	BlackRock Asset Management Ireland Ltd. 	IE00BDDRF478 
ISHARES S&P 500 ENERGY SECT ETF 	BlackRock Asset Management Ireland Ltd. 	IE00B42NKQ00 
ISHARES S&P 500 EUR HEDGED ETF 	BlackRock Asset Management Ireland Ltd. 	IE00B3ZW0K18 
ISHARES S&P 500 FINANCIALS SECT ETF 	BlackRock Asset Management Ireland Ltd. 	IE00B4JNQZ49 
ISHARES S&P 500 HEALTH CARE SECT ETF 	BlackRock Asset Management Ireland Ltd. 	IE00B43HR379 
ISHARES S&P 500 INDUSTRIALS SECT ETF 	BlackRock Asset Management Ireland Ltd. 	IE00B4LN9N13 
ISHARES S&P 500 INFO TECH SECT ETF 	BlackRock Asset Management Ireland Ltd. 	IE00B3WJKG14 
ISHARES S&P 500 MATERIALS SECTOR ETF 	BlackRock Asset Management Ireland Ltd. 	IE00B4MKCJ84 
ISHARES S&P 500 SWAP ETF 	BlackRock Asset Management Ireland Ltd. 	IE00BMTX1Y45 
ISHARES S&P 500 UTILITIES SECTOR ETF 	BlackRock Asset Management Ireland Ltd. 	IE00B4KBBD01 
ISHARES S&P SMALL CAP 600 ETF 	BlackRock Asset Management Ireland Ltd. 	IE00B2QWCY14 
ISHARES S&P U.S. BANKS ETF 	BlackRock Asset Management Ireland Ltd. 	IE00BD3V0B10 
ISHARES SPAIN GOVT BOND ETF 	BlackRock Asset Management Ireland Ltd. 	IE00B428Z604 
ISHARES STOXX EUROPE 50 (DE) 	BlackRock Asset Management Deutschland AG (KVG) 	DE0005933949 
ISHARES STOXX EUROPE 50 ETF 	BlackRock Asset Management Ireland Ltd. 	IE0008470928 
ISHARES STOXX EUROPE 600 (DE) 	BlackRock Asset Management Deutschland AG (KVG) 	DE0002635307 
ISHARES STOXX EUROPE 600 AUTO & P (DE) 	iShares [DE] I Investmentaktiengesellschaft mit … 	DE000A0Q4R28 
ISHARES STOXX EUROPE 600 BANKS (DE) 	iShares [DE] I Investmentaktiengesellschaft mit … 	DE000A0F5UJ7 
ISHARES STOXX EUROPE 600 BAS RES (DE) 	iShares [DE] I Investmentaktiengesellschaft mit … 	DE000A0F5UK5 
ISHARES STOXX EUROPE 600 CHEMICALS (DE) 	iShares [DE] I Investmentaktiengesellschaft mit … 	DE000A0H08E0 
ISHARES STOXX EUROPE 600 CNSTR & M (DE) 	iShares [DE] I Investmentaktiengesellschaft mit … 	DE000A0H08F7 
ISHARES STOXX EUROPE 600 FIN SER (DE) 	iShares [DE] I Investmentaktiengesellschaft mit … 	DE000A0H08G5 
ISHARES STOXX EUROPE 600 FOOD&BEV (DE) 	iShares [DE] I Investmentaktiengesellschaft mit … 	DE000A0H08H3 
