Name	Emittent	ISIN
AIRLINES, HOTELS, CRUISE LINES ETF 	HANetf Management Ltd. 	IE00BMFNW783 
AIS INDEX US CORP SRI 	Amundi Luxembourg S.A. 	LU2297533809 
AIS INDEX US CORP SRI 	Amundi Luxembourg S.A. 	LU1806495575 
AIS-AM.E.L.S.F.EOC 	Amundi Luxembourg S.A. 	LU1681041544 
AIS-AM.GL.EM.B.M.I.DR DLC 	Amundi Luxembourg S.A. 	LU1681041205 
AIS-AM.US T.1-3 UE DR DLC 	Amundi Luxembourg S.A. 	LU1681040819 
AIS-AM.US.T.3-7 UE DR DLC 	Amundi Luxembourg S.A. 	LU1681040736 
AIS-ITALY MIB ESG DREOA 	Amundi Luxembourg S.A. 	LU1681037518 
ALERIAN MIDSTREAM ENERGY DIVIDEND ETF 	HANetf Management Ltd. 	IE00BKPTXQ89 
AMUNDI ETF DAX DR 	Amundi Asset Management 	FR0010655712 
AMUNDI INDEX EURO AGG SRI 	Amundi Luxembourg S.A. 	LU2182388236 
AMUNDI INDEX EURO CORPORATE SRI 0-3 Y 	Amundi Luxembourg S.A. 	LU2037748774 
AMUNDI IS AMUNDI ER IST CLM PRS ALGD PAB 	Amundi Luxembourg S.A. 	LU2182388582 
AMUNDI IS AMUNDI EURO CORP 0-1Y ESG 	Amundi Luxembourg S.A. 	LU2300294316 
AMUNDI IS AMUNDI MSCI EMU ESG UVS SLT 	Amundi Luxembourg S.A. 	LU2109786827 
AMUNDI IS AMUNDI MSCI EMU SRI PAB 	Amundi Luxembourg S.A. 	LU2109787635 
AMUNDI IS AMUNDI MSCI ER CLM PRS ALG PAB 	Amundi Luxembourg S.A. 	LU2182388319 
AMUNDI IS AMUNDI MSCI EUROPE SRI PAB 	Amundi Luxembourg S.A. 	LU1861137484 
AMUNDI IS AMUNDI MSCI USA SRI PAB 	Amundi Luxembourg S.A. 	LU1861136247 
AMUNDI IS AMUNDI SMART CITY ETF 	Amundi Luxembourg S.A. 	LU2037748345 
AMUNDI IS AMUNDI SMART FACTORY ETF 	Amundi Luxembourg S.A. 	LU2037749822 
AMUNDI IS BBB EURO CORP INVM GRD ESG 	Amundi Luxembourg S.A. 	LU1681041387 
AMUNDI IS CAC 40 	Amundi Luxembourg S.A. 	LU1681046931 
AMUNDI IS EQ GLBL MLT SMRT ALLC SCI BETA 	Amundi Luxembourg S.A. 	LU1602145119 
AMUNDI IS EURO CORP BBB 1-5 	Amundi Luxembourg S.A. 	LU1525418643 
AMUNDI IS EURO CORPORATE SRI 	Amundi Luxembourg S.A. 	LU1681039647 
AMUNDI IS EURO CORPORATE SRI 	Amundi Luxembourg S.A. 	LU1437018168 
AMUNDI IS EURO HIGH YIELD BOND ESG 	Amundi Luxembourg S.A. 	LU1681040496 
AMUNDI IS EURO STOXX 50 	Amundi Luxembourg S.A. 	LU1681047319 
AMUNDI IS EURO STOXX 50 	Amundi Luxembourg S.A. 	LU1681047236 
AMUNDI IS FLOATING RATE EURO CORP ESG 	Amundi Luxembourg S.A. 	LU1681041114 
AMUNDI IS FLOATING RATE USD CORP ESG 	Amundi Luxembourg S.A. 	LU1681041031 
AMUNDI IS FLOATING RATE USD CORP ESG 	Amundi Luxembourg S.A. 	LU1681040900 
AMUNDI IS FTSE EPRA EUROPE REAL ESTATE 	Amundi Luxembourg S.A. 	LU1681039480 
AMUNDI IS FTSE EPRA NAREIT GLOBAL 	Amundi Luxembourg S.A. 	LU1437018838 
AMUNDI IS GOVT BOND EURMTS BRD INVM GRD 	Amundi Luxembourg S.A. 	LU1681046261 
AMUNDI IS GVT BD HGHST RTD ERMTS INVMGR 	Amundi Luxembourg S.A. 	LU1681046691 
AMUNDI IS GVT BD LWST RTD ERMTS INVM GR 	Amundi Luxembourg S.A. 	LU1681046857 
AMUNDI IS GVT BD LWST RTD ERMTS INVM GR 	Amundi Luxembourg S.A. 	LU1681046774 
AMUNDI IS JAPAN TOPIX 	Amundi Luxembourg S.A. 	LU1681037864 
AMUNDI IS JP MORGAN EMU GOVIES 	Amundi Luxembourg S.A. 	LU1737653714 
AMUNDI IS JP MORGAN EMU GOVIES 	Amundi Luxembourg S.A. 	LU1437018598 
AMUNDI IS JP MORGAN GBI GLOBAL GOVIES 	Amundi Luxembourg S.A. 	LU1708330235 
AMUNDI IS JP MORGAN GBI GLOBAL GOVIES 	Amundi Luxembourg S.A. 	LU1437016204 
AMUNDI IS JPX-NIKKEI 400 	Amundi Luxembourg S.A. 	LU1681039134 
AMUNDI IS JPX-NIKKEI 400 	Amundi Luxembourg S.A. 	LU1681038912 
AMUNDI IS MSCI CHINA 	Amundi Luxembourg S.A. 	LU1681043912 
AMUNDI IS MSCI EASTERN EUROPE EX RUSSIA 	Amundi Luxembourg S.A. 	LU1681043755 
AMUNDI IS MSCI EM ASIA 	Amundi Luxembourg S.A. 	LU1681044480 
AMUNDI IS MSCI EM LATIN AMERICA 	Amundi Luxembourg S.A. 	LU1681045024 
AMUNDI IS MSCI EMERGING MARKETS 	Amundi Luxembourg S.A. 	LU1737652583 
AMUNDI IS MSCI EMERGING MARKETS 	Amundi Luxembourg S.A. 	LU1437017350 
AMUNDI IS MSCI EMERGING MARKETS SRI PAB 	Amundi Luxembourg S.A. 	LU1861138961 
AMUNDI IS MSCI EMERGINGMARKETS 	Amundi Luxembourg S.A. 	LU1681045370 
AMUNDI IS MSCI EUROPE 	Amundi Luxembourg S.A. 	LU1437015735 
AMUNDI IS MSCI EUROPE ESG BROAD CTB 	Amundi Luxembourg S.A. 	LU1681042609 
AMUNDI IS MSCI EUROPE MINIMUM VOL FCTR 	Amundi Luxembourg S.A. 	LU1681041627 
AMUNDI IS MSCI EUROPE MOMENTUM FACTOR 	Amundi Luxembourg S.A. 	LU1681041460 
AMUNDI IS MSCI EUROPE QUALITY FACTOR 	Amundi Luxembourg S.A. 	LU1681041890 
AMUNDI IS MSCI INDIA 	Amundi Luxembourg S.A. 	LU1681043086 
AMUNDI IS MSCI JAPAN 	Amundi Luxembourg S.A. 	LU1602144732 
AMUNDI IS MSCI JAPAN SRI PAB 	Amundi Luxembourg S.A. 	LU2233156749 
AMUNDI IS MSCI NORDIC 	Amundi Luxembourg S.A. 	LU1681044647 
AMUNDI IS MSCI NORTH AMERICA 	Amundi Luxembourg S.A. 	LU1737653045 
AMUNDI IS MSCI NORTH AMERICA 	Amundi Luxembourg S.A. 	LU1437016543 
AMUNDI IS MSCI SWITZERLAND 	Amundi Luxembourg S.A. 	LU1681044720 
AMUNDI IS MSCI USA 	Amundi Luxembourg S.A. 	LU1681042864 
AMUNDI IS MSCI USA MINIMUM VOLATIL FAC 	Amundi Luxembourg S.A. 	LU1589349734 
AMUNDI IS MSCI WORLD 	Amundi Luxembourg S.A. 	LU1737652237 
AMUNDI IS MSCI WORLD 	Amundi Luxembourg S.A. 	LU1437016972 
AMUNDI IS MSCI WORLD CLMT PARIS ALGN PAB 	Amundi Luxembourg S.A. 	LU2182388400 
AMUNDI IS MSCI WORLD ENERGY 	Amundi Luxembourg S.A. 	LU1681046006 
AMUNDI IS MSCI WORLD ETF 	Amundi Luxembourg S.A. 	LU1681043599 
AMUNDI IS MSCI WORLD EX EUROPE 	Amundi Luxembourg S.A. 	LU1681045537 
AMUNDI IS MSCI WORLD SRI PAB 	Amundi Luxembourg S.A. 	LU1861134382 
AMUNDI IS NASDAQ-100 	Amundi Luxembourg S.A. 	LU1681038599 
AMUNDI IS NASDAQ-100 	Amundi Luxembourg S.A. 	LU1681038243 
AMUNDI IS PRIME EURO GOVIES 	Amundi Luxembourg S.A. 	LU1931975152 
AMUNDI IS RUSSELL 2000 	Amundi Luxembourg S.A. 	LU1681038672 
AMUNDI IS S&P 500 BUYBACK 	Amundi Luxembourg S.A. 	LU1681048127 
AMUNDI IS S&P 500 ESG 	Amundi Luxembourg S.A. 	LU1437017863 
AMUNDI IS S&P 500 ETF 	Amundi Luxembourg S.A. 	LU1681049109 
AMUNDI IS S&P 500 ETF 	Amundi Luxembourg S.A. 	LU1681048804 
AMUNDI IS S&P GLOBAL LUXURY 	Amundi Luxembourg S.A. 	LU1681048630 
AMUNDI IS STOXX EUROPE 600 	Amundi Luxembourg S.A. 	LU1681040223 
AMUNDI MSCI EMU ESG LEADERS SELECT 	Amundi Luxembourg S.A. 	LU1602144575 
AMUNDI MSCI GLOBAL CLIMATE TRNSTN CTB 	Amundi Luxembourg S.A. 	LU1602144229 
AMUNDI SOL MSCI PAC EX JPN SRI PAB FD 	Amundi Luxembourg S.A. 	LU1602144906 
AMUNDI STOXX GLOBAL ARTIFICIAL INTLGC 	Amundi Luxembourg S.A. 	LU1861132840 
BLACKROCK ESG MULTI-ASSET CNSRV PTF ETF 	BlackRock Asset Management Ireland Ltd. 	IE00BLP53M98 
BLACKROCK ESG MULTI-ASSET GROWTH PTF ETF 	BlackRock Asset Management Ireland Ltd. 	IE00BLLZQ805 
BLACKROCK ESG MULTI-ASSET MOD PTF ETF 	BlackRock Asset Management Ireland Ltd. 	IE00BLLZQS08 
BNNP E JPM ESG EMU GOVT BD IG 3-5 Y 	BNP PARIBAS ASSET MANAGEMENT Luxembourg 	LU2244387457 
BNP PARIBAS E CP BD SRI FSL FR 1-3Y 	BNP PARIBAS ASSET MANAGEMENT Luxembourg 	LU2008760592 
BNP PARIBAS EASY CORP BOND SRI FSSL FR 	BNP PARIBAS ASSET MANAGEMENT Luxembourg 	LU1859444769 
BNP PARIBAS EASY HIGH YIELD SRI FSSLFR 	BNP PARIBAS ASSET MANAGEMENT Luxembourg 	LU2244386053 
BNPP E ECPI GLOBAL ESG BLUE ECONOMY 	BNP PARIBAS ASSET MANAGEMENT Luxembourg 	LU2194447293 
BNPP E ECPI GLOBAL ESG INFRASTRUCTURE 	BNP PARIBAS ASSET MANAGEMENT Luxembourg 	LU1291109293 
BNPP E ESG EQUITY VALUE EUROPE 	BNP PARIBAS ASSET MANAGEMENT Luxembourg 	LU1377382285 
BNPP E FTSE EPRA NRT DEV EUR EX UKGRNCTB 	BNP PARIBAS ASSET MANAGEMENT Luxembourg 	LU2008763935 
BNPP E FTSE EPRA/NAREIT DEVELOPED EUROPE 	BNP PARIBAS ASSET MANAGEMENT Luxembourg 	LU1291091228 
BNPP E FTSE EPRA/NAREIT EUROZONE CAPPED 	BNP PARIBAS ASSET MANAGEMENT Luxembourg 	LU0950381748 
BNPP E FTSE EPRA/NAREIT EUROZONE CAPPED 	BNP PARIBAS ASSET MANAGEMENT Luxembourg 	LU0192223062 
BNPP E LOW CARBON 100 EUROPE PAB 	BNP PARIBAS ASSET MANAGEMENT Luxembourg 	LU1377382368 
BNPP E MSCI EMU EX CW 	BNP PARIBAS ASSET MANAGEMENT Luxembourg 	LU1291098827 
BNPP E MSCI EUROPE SRI S-SR PAB 5% CPD 	BNP PARIBAS ASSET MANAGEMENT Luxembourg 	LU1753045415 
BNPP E MSCI EURP SMCP SRI S-SR PAB 5%CPD 	BNP PARIBAS ASSET MANAGEMENT Luxembourg 	LU1291101555 
BNPP E MSCI JAPAN ESG FILTERED MIN TE 	BNP PARIBAS ASSET MANAGEMENT Luxembourg 	LU1481203070 
BNPP E MSCI JAPAN SRI S-SR PAB 5% CPD 	BNP PARIBAS ASSET MANAGEMENT Luxembourg 	LU1753045928 
BNPP E MSCI NA ESG FILTERED MIN TE 	BNP PARIBAS ASSET MANAGEMENT Luxembourg 	LU1291104575 
BNPP E MSCI PAC EX JPN ESG FILTRD MIN TE 	BNP PARIBAS ASSET MANAGEMENT Luxembourg 	LU1291106356 
BNPP E MSCI USA SRI S-SR PAB 5% CPD 	BNP PARIBAS ASSET MANAGEMENT Luxembourg 	LU1659681669 
BNPP E MSCI WORLD SRI S-SR PAB 5% CPD 	BNP PARIBAS ASSET MANAGEMENT Luxembourg 	LU1615092217 
BNPP EASY S&P 500 ETF 	BNP PARIBAS ASSET MANAGEMENT France 	FR0013041530 
BNPP EASY S&P 500 ETF 	BNP PARIBAS ASSET MANAGEMENT France 	FR0011550185 
BNPP EASY STOXX EUROPE 600 ETF 	BNP PARIBAS ASSET MANAGEMENT France 	FR0011550193 
CSIF (IE) DAX 50 ESG BLUE UCITS ETF 	Carne Global Fund Managers [Ireland] Ltd. 	IE00BKVD2J03 
CSIF (IE) FTSE EPRA NAREIT DEV GRN BLETF 	Carne Global Fund Managers [Ireland] Ltd. 	IE00BMDX0K95 
CSIF (IE) MSCI USATECH125ESGUNVSLBLUEETF 	Carne Global Fund Managers [Ireland] Ltd. 	IE000YKE1AQ5 
CSIF (IE) MSCI WLD ESG LDRS MIN VOLBLETF 	Carne Global Fund Managers [Ireland] Ltd. 	IE00BMDX0M10 
DEKA DAX ETF 	Deka Investment GmbH 	DE000ETFL011 
DEKA DAXPLUS MAX DIV ETF 	Deka Investment GmbH 	DE000ETFL235 
DEKA DT. BOERSE EUROGOV GER 5-10 ETF 	Deka Investment GmbH 	DE000ETFL201 
DEKA EURO ISTOXX EX FIN DIVIDEND+ ETF 	Deka Investment GmbH 	DE000ETFL482 
DEKA EURO STOXX 50 ETF 	Deka Investment GmbH 	DE000ETFL029 
DEKA EURO STOXX SELECT DIVIDEND 30 ETF 	Deka Investment GmbH 	DE000ETFL078 
DEKA FUT.ENER.ESG UE 	Deka Investment GmbH 	DE000ETFL607 
DEKA IBOXX LIQ NON-FINCLS DVRSFD ETF 	Deka Investment GmbH 	DE000ETFL383 
DEKA MDAX ETF 	Deka Investment GmbH 	DE000ETFL441 
DEKA MSCI EMU CLIM CHG ESG UCITS ETF 	Deka Investment GmbH 	DE000ETFL557 
DEKA MSCI EUROPE CLIM CHG ESG UCITS ETF 	Deka Investment GmbH 	DE000ETFL565 
DEKA MSCI GERMANY CLIM CHG ESG UCITS ETF 	Deka Investment GmbH 	DE000ETFL540 
DEKA MSCI JAP CLIM CHA ESG UCITS ETF 	Deka Investment GmbH 	DE000ETFL318 
DEKA MSCI USA CLIM CHG ESG UCITS ETF 	Deka Investment GmbH 	DE000ETFL573 
DEKA MSCI WORLD CLIM CHG ESG UCITS ETF 	Deka Investment GmbH 	DE000ETFL581 
DEKA STOXX EUROPE STRONG GROWTH 20 ETF 	Deka Investment GmbH 	DE000ETFL037 
EMQQ EMERGING MARKETS INTERNET&ECOMM ETF 	HANetf Management Ltd. 	IE00BFYN8Y92 
ETC GRP DGTL ASSTS AND BLOCKCHAIN EQ ETF 	HANetf Management Ltd. 	IE00BMQ8YK98 
FIDCLEANENERETF DLA 	FIL Investment Management [Luxembourg] S.A. 	IE0002MXIF34 
FIDCLOUDCOMPETF DLA 	FIL Investment Management [Luxembourg] S.A. 	IE000M0ZXLY9 
FIDDIGHEALTHETF DLA 	FIL Investment Management [Luxembourg] S.A. 	IE000BPQIAA3 
FIDELITY EMERGING MARKETS QUAL INC ETF 	FIL Investment Management [Luxembourg] S.A. 	IE00BYSX4846 
FIDELITY EMERGING MARKETS QUAL INC ETF 	FIL Investment Management [Luxembourg] S.A. 	IE00BYSX4739 
FIDELITY EUROPE QUALITY INCOME ETF 	FIL Investment Management [Luxembourg] S.A. 	IE00BYSX4283 
FIDELITY EUROPE QUALITY INCOME ETF 	FIL Investment Management [Luxembourg] S.A. 	IE00BYSX4176 
FIDELITY GLOBAL QUALITY INCOME ETF 	FIL Investment Management [Luxembourg] S.A. 	IE00BYXVGZ48 
FIDELITY GLOBAL QUALITY INCOME ETF 	FIL Investment Management [Luxembourg] S.A. 	IE00BYV1YH46 
FIDELITY SUST GLB CORP BD MLTFCTR ETF 	FIL Investment Management [Luxembourg] S.A. 	IE00BM9GRM34 
FIDELITY SUST RSH ENH JPN EQ ETF 	FIL Investment Management [Luxembourg] S.A. 	IE00BNGFMX61 
FIDELITY SUST RSH ENH PAC EX-JPN EQ ETF 	FIL Investment Management [Luxembourg] S.A. 	IE00BNGFMY78 
FIDELITY SUSTAINABLE RSH ENH EM EQ ETF 	FIL Investment Management [Luxembourg] S.A. 	IE00BLRPN388 
FIDELITY SUSTAINABLE RSH ENH EURP EQ ETF 	FIL Investment Management [Luxembourg] S.A. 	IE00BKSBGT50 
FIDELITY SUSTAINABLE RSH ENH GLB EQ ETF 	FIL Investment Management [Luxembourg] S.A. 	IE00BKSBGV72 
FIDELITY SUSTAINABLE RSH ENH US EQ ETF 	FIL Investment Management [Luxembourg] S.A. 	IE00BKSBGS44 
FIDELITY SUSTAINABLE USD EM BOND ETF 	FIL Investment Management [Luxembourg] S.A. 	IE00BM9GRP64 
FIDELITY US QUALITY INCOME ETF 	FIL Investment Management [Luxembourg] S.A. 	IE00BYXVGY31 
FIDELITY US QUALITY INCOME ETF 	FIL Investment Management [Luxembourg] S.A. 	IE00BYXVGX24 
FIDELITY US QUALITY INCOME ETF 	FIL Investment Management [Luxembourg] S.A. 	IE00BYV1Y969 
FIDEVFUTTRAETF DLA 	FIL Investment Management [Luxembourg] S.A. 	IE0009MG7KH8 
FIDMETAVERSEETF DLA 	FIL Investment Management [Luxembourg] S.A. 	IE000TLLSP66 
FIRST TRUST CLOUD COMPUTING ETF 	First Trust Advisors L.P. 	IE00BFD2H405 
FIRST TRUST EUROZONE ALPHADEX ETF 	First Trust Advisors L.P. 	IE00B8X9NY41 
FIRST TRUST GERMANY ALPHADEX ETF 	First Trust Advisors L.P. 	IE00BWTNM966 
FIRST TRUST GLB CAP STRNGTH ESG LDRS ETF 	First Trust Advisors L.P. 	IE00BKPSPT20 
FIRST TRUST NASDAQ CYBERSECURITY ETF 	First Trust Advisors L.P. 	IE00BF16M727 
FIRST TRUST US LARGE CAP CORE ALPHADEX 	First Trust Advisors L.P. 	IE00B8X9NW27 
FRANKLIN FTSE BRAZIL UCITS ETF 	Franklin Templeton International Services S.à.r.… 	IE00BHZRQY00 
FRANKLIN FTSE CHINA UCITS ETF 	Franklin Templeton International Services S.à.r.… 	IE00BHZRR147 
FRANKLIN FTSE INDIA UCITS ETF 	Franklin Templeton International Services S.à.r.… 	IE00BHZRQZ17 
FRANKLIN FTSE KOREA UCITS ETF 	Franklin Templeton International Services S.à.r.… 	IE00BHZRR030 
FRANKLIN LIBERTY EURO GREEN BOND ETF 	Franklin Templeton International Services S.à.r.… 	IE00BHZRR253 
FRANKLIN LIBERTY EURO SHORT MATURITY ETF 	Franklin Templeton International Services S.à.r.… 	IE00BFWXDY69 
FRANKLIN LIBERTYQ AC ASIA EX JAPAN ETF 	Franklin Templeton International Services S.à.r.… 	IE00BFWXDV39 
FRANKLIN LIBERTYQ EMERGING MARKETS ETF 	Franklin Templeton International Services S.à.r.… 	IE00BF2B0K52 
FRANKLIN LIBERTYQ EUROPEAN DIVIDEND ETF 	Franklin Templeton International Services S.à.r.… 	IE00BF2B0L69 
FRANKLIN LIBERTYQ EUROPEAN EQUITY ETF 	Franklin Templeton International Services S.à.r.… 	IE00BFWXDW46 
FRANKLIN LIBERTYQ GLOBAL DIVIDEND ETF 	Franklin Templeton International Services S.à.r.… 	IE00BF2B0M76 
FRANKLIN LIBERTYQ GLOBAL EQUITY SRI ETF 	Franklin Templeton International Services S.à.r.… 	IE00BF2B0N83 
FRANKLIN LIBERTYQ U.S. EQUITY ETF 	Franklin Templeton International Services S.à.r.… 	IE00BF2B0P08 
FRANKLIN S&P 500 PARIS ALIGNED CLMT ETF 	Franklin Templeton International Services S.à.r.… 	IE00BMDPBZ72 
FRANKLIN STOXX EURP 600PARISALGNDCLMTETF 	Franklin Templeton International Services S.à.r.… 	IE00BMDPBY65 
FST TR NASDAQ CLEAN EDGE GREEN ENGY ETF 	First Trust Advisors L.P. 	IE00BDBRT036 
FT ICAV-FR.METAV.ETF EOA 	Franklin Templeton International Services S.à.r.… 	IE000IM4K4K2 
GL.X-URANIUM DLA 	Carne Global Fund Managers [Ireland] Ltd. 	IE000NDWFGA5 
GLOBAL X AGTECH & FOOD INNOVATION ETF 	Carne Global Fund Managers [Ireland] Ltd. 	IE000EBFYWX3 
GLOBAL X AUTONOMOUS &ELECTRICVEHICLESETF 	Carne Global Fund Managers [Ireland] Ltd. 	IE00BMH5YR69 
GLOBAL X CLEAN WATER ETF 	Carne Global Fund Managers [Ireland] Ltd. 	IE000BWKUES1 
GLOBAL X CLEANTECH ETF 	Carne Global Fund Managers [Ireland] Ltd. 	IE00BMH5YL08 
GLOBAL X CLOUD COMPUTING ETF 	Carne Global Fund Managers [Ireland] Ltd. 	IE00BMH5YF48 
GLOBAL X COPPER MINERS ETF 	Carne Global Fund Managers [Ireland] Ltd. 	IE0003Z9E2Y3 
GLOBAL X CYBERSECURITY ETF 	Carne Global Fund Managers [Ireland] Ltd. 	IE00BMH5Y871 
GLOBAL X DT CENTER REITS&DGTL INFRAS ETF 	Carne Global Fund Managers [Ireland] Ltd. 	IE00BMH5Y327 
GLOBAL X E-COMMERCE ETF 	Carne Global Fund Managers [Ireland] Ltd. 	IE00BMH5XY61 
GLOBAL X FINTECH ETF 	Carne Global Fund Managers [Ireland] Ltd. 	IE00BLCHJZ35 
GLOBAL X GENOMICS & BIOTECHNOLOGY ETF 	Carne Global Fund Managers [Ireland] Ltd. 	IE00BM8R0N95 
GLOBAL X INTERNET OF THINGS ETF 	Carne Global Fund Managers [Ireland] Ltd. 	IE00BLCHJT74 
GLOBAL X LITHIUM & BATTERY TECH ETF 	Carne Global Fund Managers [Ireland] Ltd. 	IE00BLCHJN13 
GLOBAL X RENEWABLE ENERGY PRODUCERS ETF 	Carne Global Fund Managers [Ireland] Ltd. 	IE00BLCHJH52 
GLOBAL X ROBOTICS & ARTFCL INTLLGNC ETF 	Carne Global Fund Managers [Ireland] Ltd. 	IE00BLCHJB90 
GLOBAL X SUPERDIVIDEND ETF 	Carne Global Fund Managers [Ireland] Ltd. 	IE00077FRP95
GLOBAL X U.S. INFRASTRUCTURE DEVPMT ETF 	Carne Global Fund Managers [Ireland] Ltd. 	IE00BLCHJ534 
GR F.OF F E.G.F DLA 	HANetf Management Ltd. 	IE000TVPSRI1 
HANETF U.S. GLOBAL JETS ETF 	HANetf Management Ltd. 	IE00BN76Y761 
HANETF-ELVECHIN DLA 	HANetf Management Ltd. 	IE000HMSHYJ6 
HANETF-ETC GG MTVS ETFDLA 	HANetf Management Ltd. 	IE000KDY10O3 
HMAAPE-J.C.P.A. DLA 	HSBC Investment Funds [Luxemburg] S.A. 	IE000XFORJ80 
HSBC ASIA PACIFIC EX JAPAN SUST EQ ETF 	HSBC Investment Funds [Luxemburg] S.A. 	IE00BKY58G26 
HSBC BLMBRG GBL SUST AGGT 1-3 YR BD ETF 	HSBC Investment Funds [Luxemburg] S.A. 	IE000XGNMWE1 
HSBC BLOOMBERG EUR SUST CORP BD ETF 	HSBC Investment Funds [Luxemburg] S.A. 	IE00BKY81B71 
HSBC BLOOMBERG USD SUST CORP BD ETF 	HSBC Investment Funds [Luxemburg] S.A. 	IE00BKY81627 
HSBC EMERGING MARKET SUSTAINABLE EQ ETF 	HSBC Investment Funds [Luxemburg] S.A. 	IE00BKY59G90 
HSBC EPRA/NARE DLA 	HSBC Investment Funds [Luxemburg] S.A. 	IE000G6GSP88 
HSBC ETF- CHINA DLA 	HSBC Investment Funds [Luxemburg] S.A. 	IE0007P4PBU1 
HSBC ETF- WORLD DLA 	HSBC Investment Funds [Luxemburg] S.A. 	IE000UQND7H4 
HSBC ETFS-SP500 DLA 	HSBC Investment Funds [Luxemburg] S.A. 	IE000JZ473P7 
HSBC EURO STOXX 50 ETF 	HSBC Investment Funds [Luxemburg] S.A. 	IE00B4K6B022 
HSBC FTSE 100 ETF 	HSBC Investment Funds [Luxemburg] S.A. 	IE00B42TW061 
HSBC HANG SENG TECH ETF 	HSBC Investment Funds [Luxemburg] S.A. 	IE00BMWXKN31 
HSBC MSCI AC FAR EAST EX JAPAN ETF 	HSBC Investment Funds [Luxemburg] S.A. 	IE00BBQ2W338 
HSBC MSCI CHINA A UCITS ETF 	HSBC Investment Funds [Luxemburg] S.A. 	IE00BF4NQ904 
HSBC MSCI CHINA ETF 	HSBC Investment Funds [Luxemburg] S.A. 	IE00B44T3H88 
HSBC MSCI EMERG MKTS ETF 	HSBC Investment Funds [Luxemburg] S.A. 	IE00B5SSQT16 
HSBC MSCI EUROPE CLIMATE PARIS ALGND ETF 	HSBC Investment Funds [Luxemburg] S.A. 	IE00BP2C0316 
HSBC MSCI JAPAN CLIMATE PARIS ALGND ETF 	HSBC Investment Funds [Luxemburg] S.A. 	IE000UU299V4 
HSBC MSCI PACIFIC EX JAPAN ETF 	HSBC Investment Funds [Luxemburg] S.A. 	IE00B5SG8Z57 
HSBC MSCI USA CLIMATE PARIS ALIGNED ETF 	HSBC Investment Funds [Luxemburg] S.A. 	IE00BP2C1S34 
HSBC MSCI USA ETF 	HSBC Investment Funds [Luxemburg] S.A. 	IE00B5WFQ436 
HSBC MSCI WORLD CLIMATE PARIS ALGND ETF 	HSBC Investment Funds [Luxemburg] S.A. 	IE00BP2C1V62 
HSBC MSCI WORLD ETF 	HSBC Investment Funds [Luxemburg] S.A. 	IE00B4X9L533 
HSBC NASDAQ GLOBAL SEMICONDUCTOR ETF 	HSBC Investment Funds [Luxemburg] S.A. 	IE000YDZG487 
HSBC S&P 500 ETF 	HSBC Investment Funds [Luxemburg] S.A. 	IE00B5KQNG97 
HSBC USA SUSTAINABLE EQUITY ETF 	HSBC Investment Funds [Luxemburg] S.A. 	IE00BKY40J65 
HSBC- EU50ETF EOA 	HSBC Investment Funds [Luxemburg] S.A. 	IE000MWUQBJ0 
HSBCETFSWEBSEQ DLA 	HSBC Investment Funds [Luxemburg] S.A. 	IE0002UTLE51 
HSBCMSCEMCPA DLA 	HSBC Investment Funds [Luxemburg] S.A. 	IE000FNVOB27 
ICLIMA GLOBAL DECARBONISATION ENBLRS ETF 	HANetf Management Ltd. 	IE00BNC1F287 
ICLIMA SMART ENERGY ETF 	HANetf Management Ltd. 	IE00BLCH4S17 
INVESCO COINSHARES GLOBAL BLOCKCHAIN ETF 	Invesco Investment Management Ltd. 	IE00BGBN6P67 
INVESCO CONSUMER DISCR S&P US SELSEC ETF 	Invesco Investment Management Ltd. 	IE00B449XP68 
INVESCO EQQQ NASDAQ-100 ETF 	Invesco Investment Management Ltd. 	IE00BFZXGZ54 
INVESCO EQQQ NASDAQ-100 ETF 	Invesco Investment Management Ltd. 	IE0032077012 
INVESCO EURO CORPORATE BOND ETF 	Invesco Investment Management Ltd. 	IE00BF51K249 
INVESCO EURO GOVERNMENT BOND 1-3 YR ETF 	Invesco Investment Management Ltd. 	IE00BGJWWY63 
INVESCO EURO STOXX 50 ETF 	Invesco Investment Management Ltd. 	IE00B60SWX25 
INVESCO EURO STOXX 50 ETF 	Invesco Investment Management Ltd. 	IE00B5B5TG76 
INVESCO EURO STOXX HI DIV LOW VOLETF 	Invesco Investment Management Ltd. 	IE00BZ4BMM98 
INVESCO EURO STOXX OPTIMISED BANKS ETF 	Invesco Investment Management Ltd. 	IE00B3Q19T94 
INVESCO FTSE EM MKTS HI DIV LOW VOL ETF 	Invesco Investment Management Ltd. 	IE00BYYXBF44 
INVESCO FTSE RAFI ALL WORLD 3000 ETF 	Invesco Investment Management Ltd. 	IE00B23LNQ02 
INVESCO FTSE RAFI EMERGING MARKETS ETF 	Invesco Investment Management Ltd. 	IE00B23D9570 
INVESCO FTSE RAFI EUROPE ETF 	Invesco Investment Management Ltd. 	IE00B23D8X81 
INVESCO FTSE RAFI US 1000 ETF 	Invesco Investment Management Ltd. 	IE00B23D8S39 
INVESCO GLOBAL BUYBACK ACHIEVERS ETF 	Invesco Investment Management Ltd. 	IE00BLSNMW37 
INVESCO GLOBAL CLEAN ENERGY ETF 	Invesco Investment Management Ltd. 	IE00BLRB0242 
INVESCO HEALTH CARE S&P US SEL SEC ETF 	Invesco Investment Management Ltd. 	IE00B3WMTH43 
INVESCO INDUSTRIALS S&P US SEL SEC ETF 	Invesco Investment Management Ltd. 	IE00B3YC1100 
INVESCO JPX-NIKKEI 400 ETF 	Invesco Investment Management Ltd. 	IE00BVGC6645 
INVESCO JPX-NIKKEI 400 ETF 	Invesco Investment Management Ltd. 	IE00BPRCH686 
INVESCO KBW NASDAQ FINTECH ETF 	Invesco Investment Management Ltd. 	IE00BYMS5W68 
INVESCO MATERIALS S&P US SELECT SEC ETF 	Invesco Investment Management Ltd. 	IE00B3XM3R14 
INVESCO MDAX ETF 	Invesco Investment Management Ltd. 	IE00BHJYDV33 
INVESCO MORNINGSTAR US ENRGINFRAMLP ETF 	Invesco Investment Management Ltd. 	IE00B94ZB998 
INVESCO MORNINGSTAR US ENRGINFRAMLP ETF 	Invesco Investment Management Ltd. 	IE00B8CJW150 
INVESCO MSCI EM MKTS ESG UNVSL SCRND ETF 	Invesco Investment Management Ltd. 	IE00BMDBMY19 
INVESCO MSCI EMERGING MARKETS ETF 	Invesco Investment Management Ltd. 	IE00B3DWVS88 
INVESCO MSCI EUROPE ESG UNVSL SCRN ETF 	Invesco Investment Management Ltd. 	IE00BJQRDL90 
INVESCO MSCI EUROPE ETF 	Invesco Investment Management Ltd. 	IE00B60SWY32 
INVESCO MSCI EUROPE EX-UK ETF 	Invesco Investment Management Ltd. 	IE00BYX5K108 
INVESCO MSCI EUROPE VALUE ETF 	Invesco Investment Management Ltd. 	IE00B3LK4Z20 
INVESCO MSCI EURP ESGLDRSCATHOLICPPLSETF 	Invesco Investment Management Ltd. 	IE00BG0NY640 
INVESCO MSCI JAPAN ETF 	Invesco Investment Management Ltd. 	IE00B60SX287 
INVESCO MSCI PAC EX JPN ESG UNVSLSCRNETF 	Invesco Investment Management Ltd. 	IE00BMDBMT65 
INVESCO MSCI USA ESG UNIVERSAL SCRN ETF 	Invesco Investment Management Ltd. 	IE00BJQRDM08 
INVESCO MSCI USA ETF 	Invesco Investment Management Ltd. 	IE00B60SX170 
INVESCO MSCI WORLD ESG UNVSL SCRN ETF 	Invesco Investment Management Ltd. 	IE00BJQRDK83 
INVESCO MSCI WORLD ETF 	Invesco Investment Management Ltd. 	IE00B60SX394 
INVESCO NASDAQ BIOTECH ETF 	Invesco Investment Management Ltd. 	IE00BQ70R696 
INVESCO NASDAQ NEXT GNRTN 100 UCITS ETF 	Invesco Investment Management Ltd. 	IE00BMD8KP97 
INVESCO QUANT STRATS ESG GLB EQMLTFCTETF 	Invesco Investment Management Ltd. 	IE00BJQRDN15 
INVESCO S&P 500 ESG ETF 	Invesco Investment Management Ltd. 	IE00BKS7L097 
INVESCO S&P 500 ETF 	Invesco Investment Management Ltd. 	IE00BYML9W36 
INVESCO S&P 500 ETF 	Invesco Investment Management Ltd. 	IE00BRKWGL70 
INVESCO S&P 500 ETF 	Invesco Investment Management Ltd. 	IE00B3YCGJ38 
INVESCO S&P 500 HIGH DIV LOW VOL ETF 	Invesco Investment Management Ltd. 	IE00BWTN6Y99 
INVESCO SOLAR ENERGY ETF 	Invesco Investment Management Ltd. 	IE00BM8QRZ79 
INVESCO STOXX EUROPE 600 ETF 	Invesco Investment Management Ltd. 	IE00B60SWW18 
INVESCO STOXX EURP 600 OPT BANKS ETF 	Invesco Investment Management Ltd. 	IE00B5MTWD60 
INVESCO STOXX EURP 600 OPT BSC RES ETF 	Invesco Investment Management Ltd. 	IE00B5MTWY73 
INVESCO STOXX EURP 600 OPT CHEMICALS ETF 	Invesco Investment Management Ltd. 	IE00B5MTY077 
INVESCO STOXX EURP 600 OPT CNST&MAT ETF 	Invesco Investment Management Ltd. 	IE00B5MTY309 
INVESCO STOXX EURP 600 OPT FINL SRVS ETF 	Invesco Investment Management Ltd. 	IE00B5MTYK77 
INVESCO STOXX EURP 600 OPT FOOD&BEV ETF 	Invesco Investment Management Ltd. 	IE00B5MTYL84 
INVESCO STOXX EURP 600 OPT HLTH CARE ETF 	Invesco Investment Management Ltd. 	IE00B5MJYY16 
INVESCO STOXX EURP 600 OPT INSURANCE ETF 	Invesco Investment Management Ltd. 	IE00B5MTXJ97 
INVESCO STOXX EURP 600 OPT MEDIA ETF 	Invesco Investment Management Ltd. 	IE00B5MTZ488 
INVESCO STOXX EURP 600 OPT OIL & GAS ETF 	Invesco Investment Management Ltd. 	IE00B5MTWH09 
INVESCO STOXX EURP 600 OPT RETAIL ETF 	Invesco Investment Management Ltd. 	IE00B5MTZM66 
INVESCO STOXX EURP 600 OPT TECHNLGY ETF 	Invesco Investment Management Ltd. 	IE00B5MTWZ80 
INVESCO STOXX EURP 600 OPT TELECOMM ETF 	Invesco Investment Management Ltd. 	IE00B5MJYB88 
INVESCO STOXX EURP 600 OPT TRV& LEISETF 	Invesco Investment Management Ltd. 	IE00B5MJYC95 
INVESCO STOXX EURP 600 OPT UTILITIES ETF 	Invesco Investment Management Ltd. 	IE00B5MTXK03 
INVESCO STOXX EURP 600 OPTAUT & PRTS ETF 	Invesco Investment Management Ltd. 	IE00B5NLX835 
INVESCO STOXX EURP 600 OPTINDGDS&SRVSETF 	Invesco Investment Management Ltd. 	IE00B5MJYX09 
INVESCO US TREASURY BOND ETF 	Invesco Investment Management Ltd. 	IE00BF2GFH28 
INVESCO UTILITIES S&P US SELECT SEC ETF 	Invesco Investment Management Ltd. 	IE00B3VPKB53 
ISH.MSCI.BRAZIL U.ETF DE 	BlackRock Asset Management Deutschland AG (KVG) 	DE000A0Q4R85 
ISHARES AGGREGATE BOND ETF 	BlackRock Asset Management Ireland Ltd. 	IE00B3DKXQ41 
ISHARES CORP BOND 0-3YR ESG ETF 	BlackRock Asset Management Ireland Ltd. 	IE00BYZTVV78 
ISHARES CORP BOND 1-5YR ETF 	BlackRock Asset Management Ireland Ltd. 	IE00B4L60045 
ISHARES CORP BOND BBB-BB ETF 	BlackRock Asset Management Ireland Ltd. 	IE00BSKRK281 
ISHARES CORP BOND ESG ETF 	BlackRock Asset Management Ireland Ltd. 	IE00BYZTVT56 
ISHARES CORP BOND EX-FNCL ETF 	BlackRock Asset Management Ireland Ltd. 	IE00B4L5ZG21 
ISHARES CORP BOND FNCL ETF 	BlackRock Asset Management Ireland Ltd. 	IE00B87RLX93 
ISHARES CORP BOND LG CP ETF 	BlackRock Asset Management Ireland Ltd. 	IE0032523478 
ISHARES CORPBD EXFNCL 1-5Y ETF 	BlackRock Asset Management Ireland Ltd. 	IE00B4L5ZY03 
ISHARES CORPBD INTRRT HDG ESG ETF 	BlackRock Asset Management Ireland Ltd. 	IE00B6X2VY59 
ISHARES COVERED BOND ETF 	BlackRock Asset Management Ireland Ltd. 	IE00B3B8Q275 
ISHARES GOVT BD 20Y TGT DUR ETF 	BlackRock Asset Management Ireland Ltd. 	IE00BSKRJX20 
